VideoID,VideoName,Views,UploadDate
wMULev0zcwE,Supermodel Elle Macpherson's Beauty Routine | Beauty Secrets | Vogue,500996,2021-10-14T16:00:06Z
KEo36JZGAc8,Purple Hearts's Sofia Carson's Soft-Glam Makeup Guide | Beauty Secrets | Vogue,2641225,2021-10-12T16:00:08Z
hFe4GT1LgaY,"Anna Wintour, Margaret Qualley, and Sofia Coppola on the Future of Chanel | Vogue",557166,2021-10-08T16:25:13Z
UXh76MKUEjo,How Top Model Ruby Aldridge Gets Runway Ready | Diary of a Model | Vogue,564729,2021-10-06T16:10:57Z
ZoCErF78IMk,Doja Cat Gets Ready for Balmain’s Music Festival | Good Morning Vogue,833320,2021-10-04T17:00:00Z
3FLqDmtp_mo,Inside a Designer’s Handcrafted NYC Apartment Filled with Wonderful Objects | Vogue,1542150,2021-09-30T18:34:13Z
K1RLzDI5glg,"Chlöe's Beauty Guide, From Sculpting Skin Care to Full Eyebrows | Beauty Secrets | Vogue",1591917,2021-09-29T16:00:12Z
et1GuwHqHo4,How Top Model Vittoria Ceretti Gets Runway Ready | Diary of a Model | Vogue,3270268,2021-09-27T16:00:02Z
-dyaApKvUdE,24 Hours With Jack Harlow | Vogue,5293763,2021-09-24T16:00:07Z
Hi0zbU3DW6o,73 Questions With Kylie Jenner | Vogue,20991160,2021-09-23T16:00:11Z
XMV3O_UoeTs,Singer & Actress Cynthia Erivo's Skin Care & All-Brown Makeup Routine | Beauty Secrets | Vogue,228601,2021-09-22T16:00:06Z
r8UpXURJHuw,The Making of Iman's Met Gala Dress | Sketch to Dress | Vogue,2023440,2021-09-17T21:24:12Z
Zd6L0zM3gVQ,Behind Irina Shayk's 'Naked Dress' Met Gala Look | Vogue,2676867,2021-09-17T18:28:09Z
xNGjKp6p7vk,Kaia Gerber Gets Ready for the Met Gala | Vogue,1350372,2021-09-17T18:00:02Z
N_jRpn3eImg,Keke Palmer Gets Ready for the Met Gala | Vogue,593011,2021-09-17T17:00:01Z
wG_mMMcNYbs,Behind Emily Ratajkowski's Dream Met Gala Dress | Vogue,1381963,2021-09-17T16:00:05Z
Y4yq726SUpE,Congresswoman Alexandria Ocasio-Cortez Gets Ready for the Met Gala | Vogue,765355,2021-09-16T21:35:39Z
WWvxT6ttDE0,BLACKPINK's Rosé Gets Ready for the Met Gala | Vogue,14416723,2021-09-16T18:12:06Z
C-QFO6W9Lmc,Behind Billie Eilish’s Old Hollywood Met Gala Look | Vogue,13791958,2021-09-16T18:08:36Z
_oC1gYOnJrg,Grimes Gets Ready for the Met Gala | Vogue,4140673,2021-09-16T16:30:01Z
nLOA2fn7ERo,24 Hours With Lil Uzi Vert | Vogue,4081151,2021-09-16T15:31:47Z
ro7lAtqFYU4,Rihanna & A$AP Rocky Arrive & Cuddle at the 2021 #MetGala #Shorts,460885,2021-09-16T01:11:12Z
Gp9tAlTiu4g,Celebrities Shine 💎on the Red Carpet at the 2021 #MetGala #Shorts,36979504,2021-09-15T23:52:40Z
PcHuTobEHyQ,Camila Cabello and Shawn Mendes Get Ready for the Met Gala | Vogue,7263640,2021-09-15T21:29:49Z
cbDGTgtU0nk,A Day with Kendall Jenner | Vogue,9693969,2021-09-15T19:40:00Z
UcFH2RzEdJw,Cara Delevingne Gets Ready for the Met Gala | Vogue,971808,2021-09-15T18:36:32Z
qEvQa6xayYE,Billie Eilish on Her Holiday Barbie Met Look & Confidence | Met Gala 2021 with Keke Palmer | Vogue,3841767,2021-09-15T17:44:49Z
rRWYKtgj0pQ,Frank Ocean on His Robot Baby | Met Gala 2021 with Keke Palmer | Vogue,948452,2021-09-15T17:23:33Z
K2TM-Bth0ts,Justin & Hailey Bieber on Dressing Up for the Met | Met Gala 2021 with Keke Palmer | Vogue,2518339,2021-09-15T16:58:37Z
8u5LHTxavTs,Timothée Chalamet on His Met Look & Meeting Keke as a Teen | Met Gala 2021 with Keke Palmer | Vogue,2011786,2021-09-15T16:34:58Z
Lt2wajbjrGA,Behind Lil Nas X's Royal Met Gala Looks | Vogue,1434438,2021-09-15T16:22:49Z
jlR-T42I18E,Kendall Jenner Gets Ready for the Met Gala | Vogue,11780244,2021-09-14T21:02:20Z
t8pbrosSimg,Olivia Rodrigo Gets Ready for the Met Gala | Vogue,7177161,2021-09-14T20:23:05Z
t8r3UwCUCfw,Emma Chamberlain Gets Ready for the Met Gala | Vogue,7715721,2021-09-14T18:29:25Z
4C7YLMl0Cc4,Ciara's Enchanting NFL Met Gala Homage | Met Gala 2021 With Emma Chamberlain | Vogue,735822,2021-09-14T05:40:04Z
fYpw6ZGk-d4,Margaret Qualley Took Her Gala Inspiration From Chanel | Met Gala 2021 With Emma Chamberlain | Vogue,653969,2021-09-14T05:40:02Z
MCJkvULeuZU,Eugene Lee Yang & Nikkie de Jager on Eugene's Last Minute Look | Met Gala 2021 w/ Emma Chamberlain,2706411,2021-09-14T05:36:10Z
6w1g3-HXcSc,"Kris Jenner Gives Emma ""Mom Energy"" For Her First Met | Met Gala 2021 With Emma Chamberlain | Vogue",3169694,2021-09-14T05:19:25Z
A8_p4nbtksg,Kate Hudson's Perfectly Pink Met Gala Entrance | Met Gala 2021 With Emma Chamberlain | Vogue,746749,2021-09-14T03:58:31Z
27hJ-c9nPKs,Chloe x Halle on Their Sisterly Rodarte Met Looks | Met Gala 2021 With Emma Chamberlain | Vogue,735054,2021-09-14T03:57:25Z
KfwWANJWJnE,Sunisa Lee on Her Olympic Gold Met Gala Look | Met Gala 2021 With Emma Chamberlain | Vogue,643896,2021-09-14T03:46:07Z
F3PEq-U9aaI,Lili Reinhart Wears Every State Flower at the Met | Met Gala 2021 With Emma Chamberlain | Vogue,2370352,2021-09-14T03:42:31Z
HPvgnt_mOns,Emily Ratajkowski on Her Bridal Red Met Gala Look | Met Gala 2021 With Emma Chamberlain | Vogue,1253894,2021-09-14T03:31:45Z
VDr4-zEqCMk,Rosalía on Her Traditional Spanish Met Look | Met Gala 2021 With Emma Chamberlain | Vogue,1301146,2021-09-14T03:30:50Z
Ptxbgn2-hn4,Kacey Musgraves on Her Equestrian Chic Met Gala Look | Met Gala 2021 With Emma Chamberlain | Vogue,771279,2021-09-14T03:19:16Z
0db572l2FDI,Donatella Versace & Maluma on Their Bedazzled Met Outfits | Met Gala 2021 With Emma Chamberlain,2380325,2021-09-14T03:16:20Z
nmjI3XEVSuc,Kendall Jenner on Her Classic Hollywood-Inspired Look | Met Gala 2021 With Emma Chamberlain | Vogue,6722722,2021-09-14T03:06:47Z
ijwugnRfbd0,Tracee Ellis Ross Gives Met Gala Advice | Met Gala 2021 With Emma Chamberlain | Vogue,625068,2021-09-14T02:52:38Z
HTN2EZeF17Q,Iman on Her Gold Dress That Took 400 Hours to Make | Met Gala 2021 With Emma Chamberlain | Vogue,1320374,2021-09-14T02:43:41Z
6vdLLfCzMDI,Gigi Hadid on Being a Farm Mom & Celebrating America | Met Gala 2021 With Emma Chamberlain | Vogue,5552364,2021-09-14T02:33:31Z
pnP-xJZg404,Hailey Bieber on Her Classically Sexy Met Gala Look | Met Gala 2021 With Emma Chamberlain | Vogue,3714930,2021-09-14T02:28:57Z
IYCljPBES3c,Dan Levy Gets Wedding Vibes From The Met Gala | Met Gala 2021 With Emma Chamberlain | Vogue,633854,2021-09-14T02:19:26Z
GOtK355NMTk,Megan Fox on Her Dracula-Inspired Met Look | Met Gala 2021 With Emma Chamberlain | Vogue,3424658,2021-09-14T02:11:11Z
nXf3Fb7wLUk,Saweetie on Her Heritage Defining Dress | Met Gala 2021 With Emma Chamberlain | Vogue,2354628,2021-09-14T02:05:48Z
G3RRIPd4KDw,Karlie Kloss on Her Rose-Inspired Met Look | Met Gala 2021 With Emma Chamberlain | Vogue,1061098,2021-09-14T02:01:00Z
qznlmg5-m0k,Madison Beer's One of a Kind Met Gala Dress | Met Gala 2021 With Emma Chamberlain | Vogue,4628405,2021-09-14T01:53:41Z
tU0E6Jiba2k,Megan Thee Stallion on Her Old Hollywood Met Gala Look | Met Gala 2021 With Emma Chamberlain | Vogue,2356638,2021-09-14T01:50:58Z
fLH-PsUZy0M,Amanda Gorman on Co-Chairing Her First Met | Met Gala 2021 With Emma Chamberlain | Vogue,701283,2021-09-14T01:42:40Z
2L9kq5upPp4,Kaia Gerber on Her Oscar de la Renta Throwback  | Met Gala 2021 With Emma Chamberlain,2080784,2021-09-14T01:35:22Z
nLIfBqib3q8,Barbie Ferreira on Her Bedazzled First Met Outfit | Met Gala 2021 With Emma Chamberlain | Vogue,2075450,2021-09-14T01:25:48Z
TWuHYRXEGbg,Serena Williams On Her Star-Studded Gucci Bodysuit | Met Gala 2021 With Emma Chamberlain | Vogue,799011,2021-09-14T01:24:12Z
eznWOyCeBfM,Grimes on Her Sci-Fi Warrior Look | Met Gala 2021 With Emma Chamberlain | Vogue,2117340,2021-09-14T01:12:15Z
0cnv2oq_aCA,Naomi Osaka on Her First Met Gala | Met Gala 2021 With Emma Chamberlain | Vogue,916839,2021-09-14T01:11:33Z
0ZFarnMzRkM,Lil Nas X on His Three Royal Outfits | Met Gala 2021 With Emma Chamberlain | Vogue,2528244,2021-09-14T00:57:35Z
zssa-tdKfBk,Anna Wintour Breaks Down 13 Met Gala Looks From 1974 to Now | Life in Looks | Vogue,4313495,2021-09-10T16:51:10Z
Dr970XU05tM,Everything You Need to Know About American Fashion | Vogue,339299,2021-09-09T17:25:46Z
QF16aIyaSb0,"Selena Gomez Shares Her Go-To Evening Routine, Met Gala Memories, and Going Blonde | Beauty Secrets",3462250,2021-09-07T16:00:02Z
huWh5c0SJXw,Money Heist's Úrsula Corberó Breaks Down Her Perfectly Pink Makeup Routine | Beauty Secrets | Vogue,5903935,2021-09-01T16:00:06Z
SNbhExKfqtA,Inside This Model's Minimalist Home Filled With Weird Objects | Vogue,2397121,2021-08-31T16:00:09Z
0RFvMSwh-_0,Angelina Jolie Shows Us the Art of Beekeeping | Vogue,1434482,2021-08-30T20:30:02Z
WRImbieqPTo,"Every Outfit Paloma Elsesser Wears in a Week | 7 Days, 7 Looks | Vogue",298862,2021-08-27T16:00:09Z
S5YyP28cSCk,Kristen Bell’s Guide to Anti-Redness Skin Care and Makeup | Beauty Secrets | Vogue,1050657,2021-08-25T16:00:10Z
LSBzJ4kqlZA,"Bella Hadid, Precious Lee, Soo Joo Park, and More On How the Pandemic Changed the Modeling World",299043,2021-08-19T16:00:05Z
ZX366rKw0w8,"Gemma Chan’s Guide to a Simple, Smudge-Proof Red Lip | Beauty Secrets | Vogue",1211388,2021-08-18T16:00:09Z
NLmt7bDXN08,2 Designers Transform Each Other’s Work (ft. John Galliano and Tomo Koizumi) | Vogue,1163405,2021-08-17T16:39:34Z
W1LYohCF3nw,"24 Hours With LILHUDDY, Singer-Songwriter Extraordinaire | Vogue",506036,2021-08-13T16:01:11Z
BuE0o_Hi1X0,"Kaia Gerber, Precious Lee, Bella Hadid, Soo Joo Park & More On Using Their Voice as a Model | Vogue",343938,2021-08-12T16:00:20Z
b7Plu03Fp7I,Bella Hadid Breaks Down 15 Looks From 2015 to Now | Life in Looks | Vogue,7746181,2021-08-11T16:00:04Z
5m_LVhnGHdU,Charli XCX's Guide to Party Girl Makeup | Beauty Secrets | Vogue,642602,2021-08-10T16:00:08Z
rtF7IA1u7jM,"Bella Hadid, Anok Yai & Modeling’s Biggest Stars Speak Out: “Representation Is the Bare Minimum”",683412,2021-08-05T11:35:12Z
WS8UfgD0YEY,Gossip Girl's Emily Alyn Lind's 7-Step Guide to a Perfect Red Lip | Beauty Secrets | Vogue,1087496,2021-08-03T16:00:07Z
Sxdk_q7AdTo,"Every Outfit Emma Chamberlain Wears in a Week | 7 Days, 7 Looks | Vogue",2254849,2021-07-30T16:00:04Z
v3ohyHjJy3M,24 Hours With Madelyn Cline | Vogue,13545677,2021-07-29T16:00:06Z
SEjdRXZyW4Q,Ricky Martin's Daily Skin-Care and Wellness Routine | Beauty Secrets | Vogue,679781,2021-07-28T16:00:11Z
MSRBV9udKi8,73 Questions With Lorde | Vogue,2799645,2021-07-27T16:00:09Z
Cg8bXMEWyY4,24 Hours With Conan Gray as He Moves to New York | Vogue,846425,2021-07-22T16:00:03Z
L0tTTU7lwg4,Zoë Kravitz's Guide to Summertime Skin Care and Makeup | Beauty Secrets | Vogue,4928022,2021-07-21T16:00:08Z
MeO31ncLf_c,How Top Model Symone Lu Gets Runway Ready | Diary of a Model | Vogue,733510,2021-07-19T16:19:38Z
Zsa-0XbuaEA,Euphoria's Sydney Sweeney Gets Ready for A Premiere | Vogue,1921378,2021-07-16T16:00:05Z
2LN_kVAeTxU,"Alexandra Daddario's Guide to Face Masks & Easy, Everyday Makeup | Beauty Secrets | Vogue",1377498,2021-07-15T16:00:08Z
lgQnjxBoJI8,Gossip Girl’s Whitney Peak on Flawless Brows and Air-Dried Curls | Beauty Secrets | Vogue,465641,2021-07-08T16:00:10Z
VyysMii-wyg,Mary J. Blige Breaks Down 11 Looks From 1994 to Now | Life in Looks | Vogue,267661,2021-06-30T16:00:03Z
5robG9XZnz8,Nathalie Emmanuel’s Guide to Natural Hair Care and Healing Breakouts | Beauty Secrets | Vogue,686532,2021-06-29T16:00:05Z
vd0Sady6fmo,73 Questions With Tavi Gevinson | Vogue,1167172,2021-06-28T16:00:09Z
LysIB_2lvuM,"Every Outfit Rosie Huntington-Whiteley Wears in a Week | 7 Days, 7 Looks | Vogue",1406088,2021-06-25T16:00:04Z
zBsqtOC8Frs,Leslie Grace’s Guide to Low-Key Glam Makeup and Second-Day Blowouts,410781,2021-06-16T16:00:16Z
7TZc2IeB6MA,"Every Outfit Adut Akech Wears in a Week | 7 Days, 7 Looks | Vogue",730513,2021-06-10T16:00:03Z
ZE8ggTiisTE,Rosalía's Guide to Pink Eyeshadow and a Slicked-Back Ponytail | Beauty Secrets | Vogue,8551030,2021-06-09T16:00:07Z
L6QJS8djygk,Selena Gomez  Breaks Down 15 Looks From 2007 to Now | Life in Looks | Vogue,10721087,2021-06-08T16:00:04Z
8RMwbbN2mws,Pose's Janet Mock Shares Her Everyday Skin-Care Routine | Beauty Secrets | Vogue,141471,2021-06-02T16:00:03Z
ZkBzd4XKml4,Laura Harrier's Easy Evening Makeup & Skin-Care Routine That Cured Her Acne | Beauty Secrets | Vogue,590110,2021-05-31T16:00:06Z
k0G2BjP_gOA,Kendall Jenner Breaks Down How Anxiety Affects Her Plans | Open Minded | Session 4 | Vogue,619663,2021-05-27T16:00:08Z
j0UIgSccQig,Cindy Crawford Breaks Down 13 Looks From 1989 to Now | Life in Looks | Vogue,2421733,2021-05-26T16:00:12Z
w95UtKQIm3U,Kaia Gerber’s Guide to Face Sculpting and Sun-Kissed Makeup | Beauty Secrets | Vogue,4797551,2021-05-25T16:00:02Z
8CUUFpRYtN4,Bella Poarch's Signature TikTok Makeup Routine | Beauty Secrets | Vogue,8103519,2021-05-21T16:00:04Z
3oeB4goJaM8,Kendall Jenner Explains How Panic Attacks Affect Her | Open Minded | Session 3 | Vogue,629126,2021-05-20T15:39:44Z
-1h-ovrtigY,"Every Outfit Kaia Gerber Wears in a Week | 7 Days, 7 Looks | Vogue",2081270,2021-05-18T13:00:02Z
riKtiYB1FPE,Kendall Jenner Breaks Down Social Media Addiction | Open Minded | Session 2 | Vogue,1465551,2021-05-13T18:21:03Z
Eupw-yTBkQI,Kendall Jenner Opens Up About Her Anxiety | Open Minded | Session 1 | Vogue,2861840,2021-05-06T18:09:06Z
MluwtOjBHwI,Lori Harvey's ’90s-Inspired Makeup Routine | Beauty Secrets | Vogue,3527942,2021-05-05T16:00:13Z
CXvG2CBJ3SE,Olivia Rodrigo's Guide to Effortless Skin-Care and Makeup | Beauty Secrets | Vogue,15906154,2021-04-29T16:00:09Z
bSMbR-V7KqI,Gwyneth Paltrow Breaks Down 13 Looks From 1995 to Now | Life in Looks | Vogue,1144254,2021-04-28T16:12:13Z
xTCirTjUXVo,"RuPaul’s Drag Race Star Symone’s Guide to Regal, Runway-Ready Makeup | Beauty Secrets | Vogue",507047,2021-04-27T16:00:07Z
P3cW9lrRJ_c,"Every Outfit Addison Rae Wears in a Week | 7 Days, 7 Looks | Vogue",1220193,2021-04-22T16:00:06Z
mJYYI863bhY,Nicola Peltz Beckham's Guide to Easy Glamour and the Perfect Cat-Eye | Beauty Secrets | Vogue,3374369,2021-04-15T16:38:12Z
5b_S-77U-h0,24 Hours With Tierra Whack | Vogue,74948,2021-04-14T16:00:08Z
qrPEcNsR-U8,Ellie Goldstein’s Guide to Clear Skin and Confidence | Beauty Secrets | Vogue,842985,2021-04-08T16:00:04Z
gIUO1GurifU,Gwyneth Paltrow’s Guide to Everyday Skin Care and Wellness | Beauty Secrets | Vogue,1814613,2021-03-30T16:00:05Z
1hSWqHOWKg0,73 Questions With Cole Sprouse | Vogue,4635135,2021-03-24T16:00:10Z
dx2V0E5G0rk,TikTok Star Avani Gregg’s Official Guide to Everyday Makeup | Beauty Secrets | Vogue,1586365,2021-03-23T16:06:58Z
UrOHqfaN4aw,Abigail Cowen’s Effortless Red Lip & Guide to Red Haired Beauty | Beauty Secrets | Vogue,2329348,2021-03-18T16:00:04Z
R3puwWJ9uYM,Kris Jenner Breaks Down 17 Looks From 1990 to Now | Life in Looks | Vogue,2056029,2021-03-17T16:06:02Z
LALR0ovhVks,At Home With Kim Kardashian - The End of An Era | Good Morning Vogue,5441155,2021-03-15T16:00:05Z
6joHBxA61MU,Dapper Dan Gets the COVID-19 Vaccine | Good Morning Vogue,984896,2021-03-15T13:00:02Z
sf7NfCe3_5Y,Euphoria's Sydney Sweeney’s Guide to Sensitive Skin Care and Soft Glam | Beauty Secrets | Vogue,11033676,2021-03-04T17:00:09Z
JO9xtvyvFEM,Catherine O'Hara Breaks Down 9 Looks From 1988 to Now | Life in Looks | Vogue,608988,2021-02-27T17:00:02Z
0pehV64IYis,Inside Michael Moon's Extreme Beauty Routine ft. Eye Tattoos & Pointed Ears | Vogue,445765,2021-02-24T17:00:05Z
NvYT-b62Rag,RuPaul’s Drag Race Star Naomi Smalls’s 70-Step Drag Transformation | Beauty Secrets | Vogue,1180512,2021-02-23T17:00:04Z
BnPTM-R_Ph0,How Top Model Issa Lish Gets Runway Ready | Diary of a Model | Vogue,390851,2021-02-19T18:09:50Z
9K_CZizKdVs,Madison Beer’s Guide to Soap Brows and Easy Blush | Beauty Secrets | Vogue,16991868,2021-02-18T18:44:11Z
g_SOBq6_JnU,Gigi Hadid’s Fantasy Fashion Video Game | Vogue,901057,2021-02-17T17:00:09Z
r7x8FbAMQAk,Latto’s Guide to Brushed-Up Brows and a Perfect Ponytail | Beauty Secrets | Vogue,985602,2021-02-10T17:00:02Z
XMCZEJVlyRY,Gigi Hadid’s Guide to Post-Pregnancy Skin Care and Contouring | Beauty Secrets | Vogue,10351947,2021-02-04T13:00:03Z
72R3MERlj8Q,Inside Charity Kase's Extreme Beauty Routine | Vogue,1251359,2021-01-29T17:00:03Z
j70MhbycFL0,"24 Hours With Dixie D’Amelio, From the Recording Studio to Valentino Fittings | Vogue",3765157,2021-01-28T17:51:05Z
gVX1BXh1ve8,"Lana Condor’s Guide to K-Beauty and Her ""To All The Boys..."" Blush Trick | Beauty Secrets | Vogue",2374729,2021-01-25T19:07:40Z
Gi2DskHXF8s,Carla Bruni Breaks Down 13 Looks From 1988 to Now | Life in Looks | Vogue,1179040,2021-01-22T15:00:01Z
I7wTe5SRRsw,"Emma Chamberlain on Her Acne Journey, and Guide to TikTok Makeup | Beauty Secrets | Vogue",5833862,2021-01-21T17:34:00Z
VN8dienBP9I,"Every Outfit the Haim Sisters Wear in a Week | 7 Days, 7 Looks | Vogue",1184121,2021-01-19T17:00:08Z
PAwewq-2I28,24 Hours With Naomi Osaka | Vogue,959160,2021-01-14T17:03:45Z
O8zZM9mgj5A,Shalom Blac’s 10-Minute Guide to Airbrushed Skin and Everyday Glam | Beauty Secrets | Vogue,321085,2021-01-13T17:07:08Z
L6SjH4H98GE,'The Marvelous Mrs. Maisel' Rachel Brosnahan's Everyday Routine | Beauty Secrets | Vogue,776204,2021-01-07T17:00:02Z
msuXu-uAJ5U,Inside Jenkin van Zyl’s Extreme Beauty Routine | Vogue,809550,2020-12-28T17:00:06Z
cn9DNpTA3QY,"Every Outfit Ashley Graham Wears in a Week | 7 Days, 7 Looks | Vogue",1472541,2020-12-22T17:02:47Z
6WsDv106euY,Dylan Sprouse & Barbara Palvin's Dinner Date | Vogue,2004878,2020-12-21T17:00:13Z
rfSw_RolJT8,Olivia Culpo’s 40-Step Guide to Dewy Skin and Winged Eyeliner | Beauty Secrets | Vogue,1973171,2020-12-17T17:00:01Z
CG4B-FbXPiM,Sophie Turner Tries Goat Yoga | Vogue,884175,2020-12-16T17:00:05Z
OWdYj6FgbvQ,Maddie Ziegler's Guide to Colorful Eye Makeup | Beauty Secrets | Vogue,5793086,2020-12-15T17:00:01Z
CPwLou93-X4,Kerry Washington's Guide to Foolproof Eyeliner and a Bold Red Lip | Beauty Secrets | Vogue,472911,2020-12-10T17:00:08Z
QF7Mcb2pnww,24 Hours With Barbie Ferreira | Vogue,1910431,2020-12-08T18:07:11Z
w_Mod73w27Q,Bella Hadid & Virgil Abloh on Blazing Your Own Trail | Forces of Fashion,359958,2020-12-07T17:00:08Z
L7TH5HHlo78,Lizzo & Jeremy Scott Discuss the Election and Diversity in Fashion | Forces of Fashion,26913,2020-12-04T17:50:25Z
k-aZ6W4mRds,Hailee Steinfeld’s Guide to Glowing Skin and Easy Everyday Makeup | Beauty Secrets | Vogue,4613098,2020-12-02T17:00:05Z
PwGCerZvJ6w,Inside Dahc Dermur VIII's Extreme Beauty Routine | Vogue,495092,2020-11-30T20:47:27Z
RLJBXNNpnHc,73 Questions With Yara Shahidi | Vogue,1399625,2020-11-25T17:00:01Z
LlOg0mUoi9Q,"Camille Rowe's Week of French Girl Style | 7 Days, 7 Looks | Vogue",2170784,2020-11-24T20:07:24Z
_upZG4YctQU,Pharrell's Morning Skin-Care Routine | Beauty Secrets | Vogue,1230710,2020-11-23T17:00:12Z
mpS6UNfnajw,Lisa Rinna’s Guide to Ageless Skin and Her Signature Plush Lips | Beauty Secrets | Vogue,1816756,2020-11-19T17:00:14Z
h8IxEHEo0bM,Kylie Minogue Breaks Down 17 Looks From 1988 to Now | Life in Looks | Vogue,1065796,2020-11-17T17:36:01Z
PYS3UZFPJWI,"Kendall Jenner's Acne Journey, Go-To Makeup and Best Family Advice | Beauty Secrets | Vogue",17371124,2020-11-12T17:00:07Z
vqAEysIGwNM,Black Lives Matter Activist Janaya Future Khan's Guide to “Glow-Up” Skin Care | Beauty Secrets,112038,2020-11-09T17:00:05Z
Fd4ugU9K0XI,Why Rick Owens Spring 2016 Was the Best Show Ever | Vogue,430152,2020-10-30T17:59:19Z
4MVHi96NZls,"Every Outfit Hailey Bieber Wears in a Week | 7 Days, 7 Looks | Vogue",6910385,2020-10-29T19:53:42Z
g99x3ufvOag,Sam Smith's Fresh Skin Care & 4-Step Makeup Routine | Beauty Secrets | Vogue,1851724,2020-10-27T17:09:47Z
16dHtzXOUPA,Emily Ratajkowski’s Pregnancy Reveal Video | Vogue,12253167,2020-10-26T19:00:02Z
oGq2v5D6B_s,Liza Koshy's Guide to Multi-Masking and Eye Makeup | Beauty Secrets | Vogue,1068128,2020-10-21T16:00:10Z
0mE1zAfOF20,Inside Spooky Kid’s Extreme Beauty Routine | Vogue,464274,2020-10-15T16:00:02Z
zpDuNzO_rwA,Lily Collins's Day-to-Night French Girl Look | Beauty Secrets | Vogue,7843370,2020-10-14T17:00:03Z
ohvN75BaY1I,Dolly Parton Breaks Down 11 Looks From 1975 to Now | Life in Looks | Vogue,2801462,2020-10-13T16:06:27Z
inDG_GldrFM,Inside Louis Vuitton's Futuristic 'Phygital' Fashion Show | Good Morning Vogue,174731,2020-10-09T17:56:08Z
KNqRPAATReg,Model Nina Agdal's Face Sculpting Secrets | Beauty Secrets | Vogue,527007,2020-10-07T17:18:31Z
xBcsIiE27WQ,24 Hours of Non-Stop Hustle with Rapper YG | Vogue,3847892,2020-10-06T16:00:01Z
6jW7fjh0g1A,Inside Moschino’s Marionette Fashion Show and Being Black in Milan Fashion | Good Morning Vogue,447509,2020-10-02T19:13:59Z
YVBPFCOkIVU,Model Grace Hartzel Changes Jobs | Vogue,89430,2020-09-30T16:00:02Z
vnsezSWJ238,"Deconstructing a $30,000 Crystal Embroidered Dress | Vogue",281076,2020-09-29T18:27:58Z
PNat03Vqeyw,"Inside Burberry's Forest Show, Sustainable Designers, and A-Cold-Wall* | Good Morning Vogue",66238,2020-09-25T17:27:43Z
kTCMb-DJh9g,73 Questions With Lizzo | Vogue,3343205,2020-09-24T13:00:01Z
YxUfLP8kYss,Addison Rae's Guide to Faux Freckles and a Go-To Glowy Makeup Look | Beauty Secrets | Vogue,6964543,2020-09-23T16:02:00Z
NmD_gxqD3hc,Iman Breaks Down 17 Looks From 1975 to Now | Life in Looks | Vogue,1757041,2020-09-22T17:50:11Z
LiSY-DwXZ2E,Why Hussein Chalayan’s Fall 2000 Show Was the Best Show Ever | Vogue,189222,2020-09-21T19:36:43Z
ESHe_pA7XEE,Dapper Dan Talks About Going From the Underground to Gucci | Vogue,702497,2020-09-17T16:54:06Z
IKsEpORLR2M,Irina Shayk’s Guide to Fresh Skin & Full Brows | Beauty Secrets | Vogue,2599458,2020-09-16T16:40:20Z
As2VdTruRcQ,Malin Akerman's Morning Routine | Beauty Secrets | Vogue,1182963,2020-09-09T16:00:03Z
XTIzsKa_yIs,24 Hours With Cindy Crawford | Vogue,423758,2020-09-08T17:29:30Z
kGg44zdgHYM,Selena Gomez's Guide to the Perfect Cat Eye | Beauty Secrets | Vogue,15980609,2020-09-03T16:00:04Z
RA9rhkPWSgs,Inside Parma Ham’s Extreme Beauty Routine | Vogue,371908,2020-09-02T16:00:06Z
evyb2UUM0Y0,24 Hours with Burna Boy | Vogue,1671028,2020-08-28T16:05:35Z
0GqdlZyWtrg,Alicia Silverstone Tells the Story Behind Her Yellow Plaid Outfit from 'Clueless' | Vogue,3939039,2020-08-27T16:05:23Z
EpGCCKB3Oag,Rihanna Answers 15 Questions From A$AP Rocky | Vogue,10166821,2020-08-26T16:00:10Z
uap1QQCTAfw,Alessia Cara Shares Her Guide to Dewy Skin and Perfect Winged Eyeliner | Beauty Secrets | Vogue,742285,2020-08-25T19:12:53Z
bXqZllqGWGQ,Congresswoman Alexandria Ocasio-Cortez's Guide to Her Signature Red Lip | Beauty Secrets | Vogue,3691742,2020-08-21T17:07:02Z
INppOzzjUAY,Kali Uchis's 38-Step Guide to ’90s Glam Beauty | Beauty Secrets | Vogue,3782041,2020-08-19T16:40:02Z
Kunqw1FWrJM,Kat Graham's Natural Hair Beauty Routine | Beauty Secrets | Vogue,4021815,2020-08-13T16:00:07Z
bcA0dGJM5-k,Sabrina Carpenter's Guide to DIY Facials and Perfect Eyeliner | Beauty Secrets | Vogue,6485896,2020-08-05T16:00:05Z
FGyANIRWMBo,Everything You Need to Know About the Little Black Dress | Vogue,244003,2020-07-31T21:50:47Z
5gp2QKjJ7Qo,Toni Braxton's Guide to Faux-Lashes and Full-Face Makeup | Beauty Secrets | Vogue,711395,2020-07-31T17:00:02Z
NJpRQnCfKmM,Why Versace’s Spring 2018 Tribute Collection Was the Best Show Ever | Vogue,383889,2020-07-30T23:58:30Z
hpikHuyvrEY,Catherine Zeta-Jones Breaks Down 14 Looks From 1987 to Now | Life in Looks | Vogue,4843483,2020-07-29T16:00:05Z
mvY7VtKvf7o,Joey King’s Guide to a Perfect Summer Glow | Beauty Secrets | Vogue,5507727,2020-07-23T19:13:08Z
x3Pvi4ACTNQ,9 Models on Racism & Privilege in the Modeling Industry | The Models | Vogue,449338,2020-07-22T16:50:51Z
hI3HWpD8EVQ,24 Hours With Ellie Goulding | Vogue,1738993,2020-07-21T19:42:51Z
0zlWu75k9Ow,Barbara Palvin's Everyday Beauty Routine | Beauty Secrets | Vogue,7802718,2020-07-17T16:00:02Z
DTRq0wN7jNM,9 Models on Mental Health & Self-Esteem in the Modeling Industry | The Models | Vogue,747272,2020-07-16T18:00:04Z
Y1YVnaTKfd0,Simone Biles's Guide to Gold Eye Makeup | Beauty Secrets | Vogue,421216,2020-07-09T16:00:06Z
AwZjWigTTHM,73 Questions With Alicia Keys | Vogue,2726400,2020-06-30T16:00:03Z
W7zeVTX-lIU,24 Hours With Saweetie | Vogue,5472157,2020-06-29T20:03:09Z
jiU5rxOBkmg,24 Hours With Princess Nokia | Vogue,494751,2020-06-26T18:24:54Z
xwxkTfGz9po,"The Kardashian-Jenner Sisters' Best Beauty Secrets, From Baking to Lip Liner | Beauty Secrets",2186153,2020-06-25T19:08:26Z
xKwChq3uedc,"Amandla Stenberg's Guide to Box Braids, Smoky Eyes, and TikTok Brows | Beauty Secrets | Vogue",4208149,2020-06-24T19:32:05Z
byVcWK2CIOE,"Troye Sivan and Peter Staley Discuss Activism, Pride, and Gay Liberation | 1:1 | Vogue",37296,2020-06-23T19:14:40Z
3_nAxdVjZ8Y,Ashley Benson's Guide to a Simple Smoky Eye | Beauty Secrets | Vogue,1252731,2020-06-22T16:00:10Z
BmAmQct3BJc,Lucy Hale's 25-Step Guide to Everyday Makeup | Beauty Secrets | Vogue,4996524,2020-06-18T16:36:53Z
EFHTNlfvpsA,Venus Williams’s Guide to “Everyday Glam” Skin Care and Makeup | Beauty Secrets | Vogue,196658,2020-06-16T17:21:15Z
mdFPgbzZNNI,Naomi Campbell's 10-Minute Beauty Routine | Beauty Secrets | Vogue,2417806,2020-06-15T15:59:25Z
-f2MtnS-fdo,73 Questions With Esther Perel | Vogue,534046,2020-05-29T16:00:03Z
MlZnMiM4EHo,Alicia Keys' Guide to Wellness-Inspired Beauty | Beauty Secrets | Vogue,2823338,2020-05-28T16:49:54Z
icgPFZLnvmk,"Priyanka Chopra, Kourtney Kardashian and More Share Their Best DIY Beauty Secrets | Vogue",1391655,2020-05-22T17:21:30Z
5yRr8Ko4G70,Dove Cameron's Ultimate Day-to-Night Beauty Routine | Beauty Secrets | Vogue,3903689,2020-05-20T16:42:02Z
48I21gisf5s,Kehlani's Everyday Skin-Care Routine and Guide to a Glowing Face | Beauty Secrets | Vogue,2840105,2020-05-13T21:00:03Z
5XQZvm2o2RI,"Ísis Valverde’s Guide to Sun-Kissed Makeup, Brazilian Style | Beauty Secrets | Vogue",2193155,2020-05-08T16:00:03Z
7YfrFMPHJdQ,Cardi B Breaks Down Her 2018 Met Gala Look (ft. Jeremy Scott) | Vogue,488983,2020-05-05T20:05:26Z
5a5tya-sSUI,Liv Tyler & Stella McCartney Break Down Their 1999 Met Gala Looks | Vogue,108946,2020-05-05T16:55:39Z
a3IYgT1ZjGQ,Everything You Need to Know About the Met Gala | Vogue,504314,2020-05-04T23:06:34Z
-fsxaOGJv0o,Naomi Campbell Breaks Down 13 Met Gala Looks From 1990 to Now | Life in Looks | Vogue,2898039,2020-05-04T20:31:17Z
