VideoID,VideoName,Views,UploadDate
WHsOoO5Ldq0,Princess Nokia Takes Afropunk | Vogue,102175,2017-08-27T16:16:33Z
iCepINjKo1s,"Kendall Jenner, Elle Fanning, Cindy Crawford, and More Discuss Their First Vogue Covers | Vogue",430287,2017-08-23T12:00:15Z
rfmXkhBieXA,Kendall Jenner Shares Her Morning Beauty Routine | Beauty Secrets | Vogue,28967006,2017-08-22T13:00:57Z
YCDVFF6-AOs,Kendall Jenner Takes You on a 360° Tour of Her Closet | Supermodel Closets | Vogue,21189506,2017-08-15T13:00:05Z
dGVVuoOarbs,73 Questions With Cindy Crawford | Vogue,4713479,2017-08-14T12:00:31Z
qW4VJmXJIZ0,Everything It Took to Create Jennifer Lawrence’s September Cover Shoot | Vogue,1800470,2017-08-09T12:01:01Z
ANZU0_nm7xI,Lizzo’s Easy Day-to-Night Beauty Look | Beauty Secrets | Vogue,272703,2017-08-01T13:00:37Z
rHa95m7rtk8,HOUSE OF Z- Official Trailer- The Zac Posen Documentary,138314,2017-07-31T14:00:19Z
r-Jo_B6EsM4,The Stars of the New Documentary 'Step' Stomp Around in Brooklyn | Vogue,36618,2017-07-27T13:01:05Z
YakTpnzw3GA,"Zayn Malik Sounds Off on Fashion, Fame, and the Meaning Behind His Home Studio | Vogue",3987462,2017-07-26T16:00:50Z
h4SU5MOanu8,Kendall Jenner Plays with The World's Cutest Kitten | Vogue,920892,2017-07-21T16:00:18Z
exfR9QMN9Mk,Céline Dion Takes Paris in the Best Couture Looks of the Season | Vogue,1015046,2017-07-20T18:12:57Z
jc0f8Xbk1vk,Miranda Kerr’s Ultimate Pre-Wedding Detox | Vogue,968998,2017-07-18T12:00:24Z
GUwlbrSqDIs,Miranda Kerr Applies Her Glowing Wedding Day Makeup | Beauty Secrets | Vogue,6168607,2017-07-17T21:01:14Z
qlB0m541Q3A,Miranda Kerr’s Fairy-Tale Wedding Dress Fitting | Vogue,2236358,2017-07-16T17:51:35Z
kjulGt3rolY,73 Questions With Gigi Hadid | Vogue,21898545,2017-07-13T10:00:50Z
z7BihsCK-wU,Naomi Watanabe’s Guide to Glitter Eyes and Bold Lips | Beauty Secrets | Vogue,9472140,2017-07-11T13:00:16Z
cPfxnrgXsVo,"Crystals, Cocktails, and Karaoke: 24 Hours With Supermodel Miranda Kerr | Vogue",804773,2017-06-28T17:18:50Z
cqpXL78yRqc,How Valentina From RuPaul’s Drag Race Becomes Fabulous | Beauty Secrets | Vogue,7814610,2017-06-23T13:00:51Z
uWLB23NCJHs,How Rapper Young M.A. Keeps It Real When She Shops | Vogue,839378,2017-06-22T19:30:36Z
iY6dw9dEqfo,"Joey Bada$$ Talks Style, Activism, and Crystals",118544,2017-06-22T13:00:31Z
1PkT05NPNJw,Watch Andreea Diaconu’s Witchy Beauty Routine | Beauty Secrets,378942,2017-06-21T20:35:15Z
Yhvk0pKPfZw,Zendaya Does 100 Years of Beauty | Vogue,8915668,2017-06-15T14:00:25Z
W61trr1tR3c,Barbie's Hari Nef's 10-Step Beauty Prep for a Night Out | Beauty Secrets | Vogue,939661,2017-06-13T13:20:01Z
ea0b6f6aNWE,24 Hours With Broadway Actress Denée Benton,185921,2017-06-11T13:00:16Z
KcrjnmE4ADY,"Hugh Jackman, Josh Groban, Idina Menzel, and More on Their Most Embarrassing Musical Auditions",106990,2017-06-09T18:00:41Z
WCCakilUekU,"James Corden, Kevin Spacey & Hugh Jackman's Audition Horror Stories | Vogue",77917,2017-06-09T16:36:22Z
XJ_JKt2f0Lk,Beth Ditto Does Brighton Beach | Vogue,64658,2017-06-08T14:00:20Z
i8y_lNU_f0I,Watch Elle Fanning Get Cannes Film Festival–Ready in Under a Minute | Vogue,5,2017-05-30T17:19:37Z
gS3vDMYNuDQ,How to Master Your Curl Pop Like Dear White People’s Logan Browning | Beauty Secrets,1791255,2017-05-30T16:39:57Z
eoganOAP_rA,Model Grace Hartzel Gets the Vogue Girl Look | Beauty Secrets | Vogue,1800264,2017-05-26T17:32:07Z
dOUV2rwMr1g,73 Questions With Priyanka Chopra | Vogue,26931465,2017-05-24T10:00:25Z
sIjSSbfXNHI,24 Hours with Katy Perry at the 2017 Met Gala | Vogue,1817613,2017-05-17T13:00:22Z
I7yNxeTZZaw,Brazilian Supermodel Isabeli Fontana Shows How to Prep Your Skin for Bed | Beauty Secrets | Vogue,1215820,2017-05-16T10:01:00Z
F0TNJHPb39c,Elle Fanning's Fan Fantasy | Vogue,2252477,2017-05-10T13:53:37Z
tiRug9yJhEo,The Best Moments From the Met Gala’s Vogue x Instagram Studio | Met Gala 2017,330430,2017-05-08T17:02:33Z
hFHwH8R9pLQ,Céline Dion’s First Met Gala Included a Musical Number | Vogue,153720,2017-05-04T10:00:40Z
e9Ur_y7ma1o,Janelle Monaé on Letting Your Imagination Soar | Met Gala 2017,46316,2017-05-03T14:48:40Z
-Rz-bttm5sE,Priyanka Chopra Gets Ready For Her First Met Gala | Met Gala 2017,3146630,2017-05-03T10:00:25Z
ms9cwNwV_gY,Wiz Khalifa Shares His Pre-Met Gala Secret | Met Gala 2017,105014,2017-05-02T23:19:26Z
9eTuI4SLTC8,Sean Combs and Cassie Get Ready for the Met Gala | Met Gala 2017,61224,2017-05-02T22:38:42Z
NydkftjjMSQ,Model Anna Cleveland Shows Off Her Stunning Comme des Garcons Dress | Met Gala 2017,55401,2017-05-02T05:54:07Z
LUM6TJbf9Rk,Thandiwe Newton on the Importance of Being Disruptive | Met Gala 2017,44322,2017-05-02T05:38:14Z
zblz_bu3Q8I,A$AP Rocky on Wearing Jeans to the Met Gala | Met Gala 2017,536551,2017-05-02T05:37:28Z
GXsnwAvCcn0,Kerry Washington and Michael Kors on Her Sexy Cutout Dress | Met Gala 2017,68181,2017-05-02T05:33:48Z
IZlPRw0QWQA,Serena Williams & Alexis Ohanian on Learning Their Baby's Gender | Met Gala 2017,451511,2017-05-02T05:27:42Z
TASTjP48t9w,Madonna on Her Army Chic Dress (and Canteen of Rosé) | Met Gala 2017,186322,2017-05-02T05:15:04Z
bnYSE5BjQe8,Kim Kardashian West on Her Simple Met Gala Look and Kanye West | Met Gala 2017,957960,2017-05-02T05:05:50Z
pGdlW_PrIrc,Jennifer Lopez and Alex Rodriguez on Always Looking Sexy | Met Gala 2017,303621,2017-05-02T04:51:57Z
2blTycz3JZY,Ashley Graham on Her First Met Gala | Met Gala 2017,154999,2017-05-02T04:44:54Z
Xzg3Yd1Yme0,Gigi Hadid on the Inspiration Behind Her Met Gala Dress | Met Gala 2017,656734,2017-05-02T04:40:48Z
ehExr8vSaIU,Caroline Kennedy Shows Off Her Comme des Garcons Gown | Met Gala 2017,68457,2017-05-02T04:12:19Z
Er67430i1jw,Lupita Nyong’o on When Sexy Takes the Front Row | Met Gala 2017,137464,2017-05-02T03:55:29Z
QhYHwJC6pbg,Rihanna on Her Game-Changing Met Gala Red Carpet Look | Met Gala 2017,729351,2017-05-02T03:36:05Z
c6J3NFCITLI,"Reese Witherspoon on Putting Women First in ""Big Little Lies"" | Met Gala 2017",88716,2017-05-02T03:22:56Z
y6BIdkJ2NpY,"Sean ""Diddy"" Combs and Cassie on Bringing Drama to the Met Gala | Met Gala 2017",126993,2017-05-02T03:15:47Z
osywo5RuCec,Future & Jourdan Dunn on Living All Over the World | Met Gala 2017,155509,2017-05-02T03:08:43Z
KXKY7VWJYek,Amy Schumer on Getting Donuts After the Met Gala | Met Gala 2017,117397,2017-05-02T03:01:45Z
wH49_Ob_hCM,Katie Holmes & Zac Posen on Elegance as the New Sexy | Met Gala 2017,77980,2017-05-02T02:57:12Z
lsXQWWBRgWw,Nicki Minaj on Daring Fashion and Her H&M Dress | Met Gala 2017,452254,2017-05-02T02:54:57Z
rOVf1ZkXR3g,"Zoë Kravitz on the ""Big Little Lies"" Finale | Met Gala 2017",127923,2017-05-02T02:15:58Z
vrriuNHvrZE,Pharrell Williams on What It Takes to Wear Comme des Garçons | Met Gala 2017,125554,2017-05-02T02:13:45Z
vxOzffnZ-Ds,Selena Gomez on Being a Fashion Newbie | Met Gala 2017,880065,2017-05-02T02:07:24Z
llwe-5MmWrE,Jaden Smith on His Dracula-Inspired Met Gala Look | Met Gala 2017,2075660,2017-05-02T02:07:01Z
xL_SDzLHuMw,Anna Wintour on Whether She Dresses Sexy or Interesting | Met Gala 2017,181509,2017-05-02T01:56:39Z
b5Omf1zaGqU,"Aziz Ansari on His ""Parents"" Tom Brady & Gisele Bündchen | Met Gala 2017",97130,2017-05-02T01:54:42Z
FXmMjWrxfC8,"James Corden on His Next ""Carpool Karaoke"" Guest | Met Gala 2017",93390,2017-05-02T01:42:50Z
U1w9uFxQeH4,Chief Curator Andrew Bolton on Rei Kawakubo's Genius | Met Gala 2017,20772,2017-05-02T01:35:14Z
y9I_o9x3-o0,"Tom Brady & Gisele Bündchen on Her ""Bootylicious"" Dress | Met Gala 2017",349052,2017-05-02T01:32:48Z
FtwFuWI-pS4,Katy Perry on Her Avant-Garde Met Gala Dress | Met Gala 2017,400281,2017-05-02T01:31:06Z
w_a4aIN-xX8,73 Questions With Aziz Ansari | Vogue,2402545,2017-04-30T10:00:29Z
1oYAHIMPQSE,Drew Barrymore’s Guide to Rosé the Right Way | Vogue,86888,2017-04-27T15:00:38Z
Q3G3RSa8OCs,Liu Wen Knows the Secret to Being a Modern Supermodel | Supermodel!,381150,2017-04-26T12:51:53Z
EVe6zujlnvI,Watch This 1980s Supermodel’s Spectacular Age-Defying Beauty Routine | Beauty Secrets | Vogue,19692506,2017-04-25T12:43:39Z
nND9qWCpHZE,"In Honor of 4/20, a Magical Edible Recipe: The Green Fairy’s Chocolate Layer Cake",48356,2017-04-20T18:16:05Z
ymI3VJKFeLw,"In Honor of 4/20, a Magical Edible Recipe: Herb-Roasted Cashews",22132,2017-04-20T18:15:05Z
bMnxopJTyfE,This Sex Columnist's Beauty Routine Will Make You Better at Flirting | Vogue,756468,2017-04-11T10:00:15Z
1ygo1q2_8OU,Lena Dunham Test Drives the Brow Microblading Trend | Vogue,135459,2017-03-29T18:12:38Z
k1AemRjiQH0,Sarah Jessica Parker Narrates the 1930s in Vogue  | Vogue by the Decade,128344,2017-03-27T18:27:13Z
sKmINEAkxok,Emily Ratajkowski’s Paris Fashion Week Adventure | Supermodel! | Vogue,327725,2017-03-24T16:21:08Z
_GFkHA5EZdE,73 Questions With Selena Gomez | Vogue,41409371,2017-03-21T12:15:52Z
mjBKNxbiD8Q,Marchesa's Georgina Chapman on Taking Inspiration From Her Ancestors | Designer Stories | Vogue,178693,2017-03-20T10:00:31Z
74nUU4SXraY,Miss Rodeo New Mexico 2016 Shows Vogue The Ropes | American Women,41936,2017-03-17T10:00:39Z
p1WD_rDHsFc,Selena Gomez Goes Behind the Scenes With Vogue,554661,2017-03-16T11:00:21Z
9ihjWXPh9Hs,A Local’s Guide to Chicano Style in Los Angeles | American Women | Vogue,847985,2017-03-15T16:00:24Z
aPYHa6RhEhw,Sarah Jessica Parker Narrates the 1960s in Vogue | Vogue by the Decade,134483,2017-03-14T10:00:44Z
EasMYnNQz80,J. Crew's Jenna Lyons on the Power of Transformation | Designer Stories | Vogue,82884,2017-03-13T16:30:30Z
MdoYnsfv-Zo,Anna Wintour on the Trends of Paris Fashion Week,89073,2017-03-11T00:07:27Z
c1wWgQOkBho,Student Eman Abbas Does Her Authentic Egyptian Cat-Eye | Beauty Secrets | Vogue,334381,2017-03-08T11:00:59Z
Yq8tORjSCQU,Rihanna’s Fenty x Puma Takes the Fashion Crowd Back to School | Paris Fashion Week Fall 2017,196243,2017-03-07T22:27:57Z
Y342lSd1eKg,How Tory Burch’s Parents Inspired Her Style | Designer Stories | Vogue,53592,2017-03-06T17:00:07Z
OtKdzBCRlPE,Daniel Arnold’s New York | Vogue,623750,2017-03-03T16:59:36Z
K3jT41U6sLo,The Alpha Kappa Alpha Sorority on Sisterhood and Community | American Women | Vogue,58882,2017-03-03T14:00:31Z
948MLgRGNyU,"Priyanka Chopra's All-Natural, DIY Skin Secrets | Beauty Secrets | Vogue",31870406,2017-03-01T11:00:52Z
fDybOpYIGo8,Anna Wintour on the Trends of Milan Fashion Week,75582,2017-03-01T00:28:30Z
rj-utwo4i9M,It was Paris from the start [Sponsored] | Vogue,490341,2017-02-28T17:00:38Z
KFzKKiFBYy0,73 Questions With Ashley Graham | Vogue,4216935,2017-02-28T13:00:47Z
9B7WAT-Gooo,Diane von Furstenberg’s Greatest Design Inspirations | Designer Stories | Vogue,42563,2017-02-27T11:00:36Z
ZAxHyA2yplg,"Ashley Graham, Chrissy Teigen, and More in New York Fashion Week’s Most Soul-Shaking Looks",175707,2017-02-25T01:13:50Z
xNxwVbzRKqM,Anna Wintour on the Trends of London Fashion Week | Vogue,51169,2017-02-24T22:42:09Z
jFZcrADRUxc,Sarah Jessica Parker Narrates 1892-1900s in Vogue  | Vogue by the Decade,90259,2017-02-23T00:38:42Z
_huCARBmbwg,Anna Wintour on the Trends of New York Fashion Week | Vogue,143173,2017-02-18T01:53:40Z
YkMFRnF9RRQ,Craig & Karl: Inside Their Transatlantic Creative Process | Inspired to Create Ep. 3,134856,2017-02-16T21:00:26Z
eE5vFvt0DN0,Sarah Jessica Parker Narrates the 1920s in Vogue  | Vogue by the Decade,170350,2017-02-16T19:22:08Z
lkpTfFtGtDQ,"Migos Talk Atlanta, Versace, and Time Travel | Vogue",113012,2017-02-15T21:19:43Z
LU3X_pkXA4Q,Sarah Jessica Parker Narrates the 1940s in Vogue  | Vogue by the Decade,114044,2017-02-15T11:00:59Z
9uIlCY4CCqc,"D.R.A.M.’s Blowout Grammy Weekend: Puppies, Cash Machines, and Balenciaga | Vogue",9152,2017-02-14T21:46:46Z
7QtOifKvuPw,141st Westminster Kennel Club Dog Show | Vogue,27692,2017-02-14T21:30:48Z
0xER5urYjsE,Sarah Jessica Parker Narrates the 1950s in Vogue  | Vogue by the Decade,120215,2017-02-09T13:01:04Z
enC_OxHiacU,"Kendall Jenner, Gigi Hadid, and Ashley Graham Talk Snacks, Tattoos, and Secret Obsessions | Vogue",1631607,2017-02-08T16:38:33Z
ie0hfksUdg0,Grace Elizabeth’s Easy Model-On-Duty Makeup | Beauty Secrets | Vogue,1980899,2017-02-07T11:00:28Z
552vc2FHhNE,73 Questions With Lena Dunham | Vogue,1695538,2017-02-07T11:00:25Z
JT4lXpaiWw8,Model Jasmine Sanders’s Golden Barbie Beauty Tutorial | Vogue,2461410,2017-01-23T11:00:21Z
X9TgP3LRJvc,Teyana Taylor’s New Dance Workout Is the Only Fitspiration You Need | Vogue,2174585,2017-01-18T14:29:00Z
jKPU56RDiHY,Dakota Johnson Finds Her Inner Supermodel | Vogue,2694830,2017-01-13T13:01:08Z
-BM6cBTJSj4,Professional Bull Rider Madness at Madison Square Garden,15330,2017-01-12T13:00:49Z
NGoczPyTxNU,Emily Ratajkowski and Priyanka Chopra Go Inside the Golden Globes for the First Time Ever | Vogue,264141,2017-01-11T02:44:17Z
FrBGUzdZ6PU,Drew Barrymore’s Genius Guide to On-the-Go Beauty | Beauty Secrets | Vogue,1444912,2017-01-09T11:00:50Z
JzD0xJ-pa2M,Bergdorf! Bodegas! Hot Cheetos! Taylor Hill Is the Supermodel Next Door | Vogue,2300323,2016-12-20T14:00:41Z
CchqGSPNvns,73 Questions With Neil Patrick Harris | Vogue,6338147,2016-12-19T13:00:20Z
-6T7s9JIiI4,Troye Sivan’s Backstage Ritual May Surprise You | Vogue,106035,2016-12-15T11:01:01Z
2GIAHiETVD4,The Victoria’s Secret Angels Have Some Surprising Opinions About Beyonce vs. Rihanna | Vogue,734810,2016-12-13T19:05:29Z
_q81QPYDKLE,"Kendall Jenner and Tyler, The Creator Take Over the Vogue Set | Vogue",6920597,2016-12-12T17:09:45Z
kJtLaR6gSOs,The 12 Most Covetable and Convincing Gifts of 2016 | Vogue,36603,2016-12-08T20:25:44Z
3aQNOYBsJP8,Ruth Negga’s Best Worst Jokes | Vogue,114665,2016-12-07T12:00:25Z
2_eCgSlPw0o,Aluna Francis of AlunaGeorge Breaks Down Her Beauty Routine | Vogue,171823,2016-12-06T11:01:09Z
3cUQTZ6EjEU,"How Kendall, Gigi, Adriana, and More Find Their Mojo Before the Victoria’s Secret Show | Vogue",441372,2016-12-06T03:22:38Z
yjP1WBklZnc,"Victoria’s Secret Angels Sleepover: Taylor Hill, Jasmine Tookes, and More Prep for the 2016 Show",1582909,2016-12-05T23:44:49Z
WCV9Y2JJE6A,Pusha T Talks His New Adidas Originals King Push EQT at Art Basel Miami | Vogue,12992,2016-12-05T23:22:12Z
NqK1M7w5UQ8,"Victoria’s Secret Angels Present Airline Safety with Adriana Lima, Alessandra Ambrosio, and More",831166,2016-12-05T11:00:47Z
J3jGT9d4NvY,Khloé Kardashian's Better Butt Workout Video | Vogue,502201,2016-12-01T11:00:37Z
vONyW7DxzjU,Karen Elson Does Manhattan Party Makeup | Beauty Secrets | Vogue,503251,2016-11-28T14:00:32Z
X0R9WoEJg3U,Adriana Lima’s 5 Moves to a Runway Ready Body | Vogue,277512,2016-11-28T11:00:33Z
jwYWXitAhg0,Ciara on How to Dress for the Red Carpet When You're Pregnant | Vogue,59768,2016-11-22T16:46:37Z
QFjnudxcfv0,Stories From Standing Rock | Vogue,73173,2016-11-22T10:30:35Z
AYHW1qYS8vI,"SZA, The Internet, and More Talk Color Theory at Tyler, the Creator’s Carnival in Los Angeles",39355,2016-11-17T11:00:58Z
Eog5RGbqgKQ,Gwyneth Paltrow’s Guide to Glowing Skin | Beauty Secrets | Vogue,2645366,2016-11-15T11:00:16Z
1iBLNAHh8i0,Michelle Obama’s Style Evolution—8 Years in 120 Seconds | Vogue,157712,2016-11-14T11:00:47Z
Y82TpuAdTHY,Contestants Pitch Their Designs to Anna Wintour and the Judges | Vogue,3306418,2016-11-11T11:00:55Z
yMQsG39DdbA,Emma Stone & Katy Perry Watch the Creative Final Fashion Show | Vogue,759435,2016-11-11T11:00:54Z
hoO38nt6ejA,Zendaya Announces 2016 CFDA/Vogue Fashion Fund Winner | Vogue,506819,2016-11-11T11:00:53Z
5YlOCs96Grc,Desiigner Models Clothing & Raps a Verse for Anna Wintour | Vogue,2055420,2016-11-11T11:00:50Z
xWmWxdohFyY,The Finalists Share Their Movie-Inspired Instagram Posts | Vogue,578772,2016-11-11T11:00:50Z
QJMvJWdENHw,Anna Wintour & Diane von Furstenberg Decide the Fashion Fund Finalists | Vogue,595073,2016-11-11T11:00:48Z
YaOThcmvrn8,How to Wear Party Season’s Boldest Makeup,148484,2016-11-10T11:00:30Z
iynyZLWqjQ8,Ashley Graham's Red Carpet Beauty Look | Beauty Secrets | Vogue,2526304,2016-11-09T11:01:09Z
nqRKdaYAK9w,"Adriana Lima, Lily Aldridge, and More Show What Happens at the Victoria’s Secret Angel Fittings",611226,2016-11-07T11:00:30Z
pEBeBQLCSx0,Suki Waterhouse’s Guide to It Brit Eyeliner | Beauty Secrets | Vogue,1457469,2016-10-31T10:00:13Z
mRNZy8caQVs,"The 19 Best Collections From Paris Fashion Week, On the Coolest Dancers in Paris | Vogue",54791,2016-10-28T16:17:38Z
MldjGJvKOBo,Victoria’s Secret Angel Jasmine Tookes Reveals the Fantasy Bra | Vogue,258862,2016-10-26T14:16:17Z
z4VT4gik54w,Ciara’s Day-to-Night Makeup Refresh | Beauty Secrets | Vogue,834926,2016-10-26T10:00:36Z
k1081-5gs9E,Grace Hartzel’s David Bowie Halloween Makeover | Beauty Secrets | Vogue,501691,2016-10-25T10:02:25Z
DSMS3SV8wpw,Watch Sofía Sanchez de Betak Get Tokyo’s Cutest Makeover | Vogue,90429,2016-10-21T15:20:29Z
2BxbHCg39Sk,Squid Game's Hoyeon Jung’s Steps for Perfect Skin and a Two-Tone Lip | Beauty Secrets | Vogue,18668014,2016-10-20T13:05:40Z
Z_5KXfgOlh0,"Kendall Jenner, Hailey Baldwin, Michael Kors, and More Show You Their Voting Moves | Vogue",117859,2016-10-18T21:33:47Z
t5z-VlMaSMI,Vince Staples' Music Writing Process? There Is No Process | Vogue,31366,2016-10-18T14:13:18Z
N8HqyuLBqnU,73 Questions With Emma Stone | Vogue,18826018,2016-10-18T13:01:03Z
_Y3n03CMLj4,"Kim Kardashian West Plays ""Would You Rather"" | Vogue",374176,2016-10-14T15:41:55Z
8uTFbKZ_Fn4,Watch Ciara’s Red Carpet Beauty Routine | Vogue,40264,2016-10-14T15:00:18Z
HF0EflD76s8,How Diane Kruger Takes Her Beauty Routine to the Front Row | Vogue,176900,2016-10-11T15:34:29Z
a0evhUFFmKM,"One Million Stories. One Million Lives Changed, Part Two: Mary",92369,2016-10-11T12:02:53Z
155rVNO-v08,"One Million Stories. One Million Lives Changed, Part Three: Margaret",51730,2016-10-11T12:00:50Z
0QekfT-lMbA,"One Million Stories. One Million Lives Changed, Part Four: Puwaneshwary",55238,2016-10-11T12:00:47Z
2hf35gTCC0M,"One Million Stories. One Million Lives Changed, Part Five: The Future",48145,2016-10-11T12:00:45Z
sw6EofWILhA,"One Million Stories. One Million Lives Changed, Part One: Sri Lanka",88473,2016-10-11T12:00:44Z
Aac1zMpMvtQ,Sean “Diddy” Combs and the Bad Boy Family on Their Best Throwback Memories | Vogue,10609,2016-10-07T16:22:47Z
QkPt3msECvs,What’s In Your Bag with Diane Lane | Vogue,748681,2016-10-05T15:11:11Z
o3Z6csvesUg,Cam’ron on his Killa Style and an unexpected Sneaker Shopping Tip | Vogue,30865,2016-10-02T20:11:20Z
KcdVxjxJhVg,Miranda Kerr Decodes Airport Style in 5 Easy Looks | Vogue,759452,2016-09-30T13:00:35Z
brHgrSxKkTE,Would Priyanka Chopra Rather Netflix and Chill or Party All Night? | Vogue,184539,2016-09-30T13:00:34Z
CxRJtHQoJpU,Rihanna on How to Rock Her Fenty x Puma Looks | Vogue,185465,2016-09-29T14:03:57Z
khB82rGejyc,Gucci Mane on Gucci: The One Review that Really Counts | Vogue,90141,2016-09-22T16:16:51Z
_W-jGaHAVdE,Gucci Owned the Runway With Its Covetable Collection for Spring 2017,28551,2016-09-22T13:36:56Z
zTu3VkuORUQ,Teyana Taylor on Air Force 1s vs. Superstars and Other Tough Choices | Would You Rather,24275,2016-09-21T14:49:54Z
U0_X4xIY3JY,Teyana Taylor on Walking in Kanye West’s Yeezy Show and Twinning With Her Husband | Vogue,48817,2016-09-20T22:57:23Z
a65_ZcAZQiE,Inside Young Thug's New York Adventure: From the Bat Mitzvah to the Studio | Vogue,73904,2016-09-20T16:10:06Z
qtXLBcplNJ0,Dree Hemingway’s Real-Girl Guide to No-Makeup Makeup | Beauty Secrets | Vogue,1048153,2016-09-20T13:00:58Z
FvkZOW5Uox4,Japanese Artist Yayoi Kusama Brings Her “Dots Obsession” to the Glass House,41783,2016-09-19T15:46:35Z
DI1BbU4uzmM,NFL Star Cam Newton and Karlie Kloss Go On Set With Vogue,125710,2016-09-18T15:00:22Z
ng6Q0OUXu_0,NBA Star Russell Westbrook’s 5 Tips for a Winning New York Fashion Week | Vogue,36780,2016-09-16T16:20:44Z
0XpjGRKkAcQ,Travis Scott’s Fashion Week Ride Is a Helicopter | Getting Ready | Vogue,52014,2016-09-16T05:20:38Z
0NMOdFEIj6o,Lupita Nyong’o Makes Ugali on Her Family Farm in Kenya | Vogue,5157843,2016-09-15T14:45:25Z
HHxRBljtoqU,73 Questions With Simone Biles | Vogue,8428368,2016-09-15T13:00:24Z
SQLsLYLlM-I,Tour Tel Aviv’s Old Jaffa With Yemenite-Israeli band A-WA of “Habib Galbi”,50202,2016-09-15T00:07:29Z
lvm7cqb1XLA,Renée Elise Goldsberry and Jasmine Cephas Jones Sing America the Beautiful | Vogue,131058,2016-09-14T23:56:54Z
C2z-vBgR7-o,Gigi Hadid on Bringing Her Sporty and Hippie Style to Tommy Hilfiger | Vogue,331504,2016-09-12T17:00:30Z
YUzx6jMMHE8,Victoria Beckham’s Pivotal NYFW Show: “I Really Feel I’ve Come Into My Own” | Vogue,95943,2016-09-12T14:51:13Z
dW-HggSE_yw,"Kendall Jenner, Michael Kors, Joan Smalls, Tory Burch, and More Show You Their Voting Dance",146654,2016-09-10T00:10:49Z
EOzCC-FJsPs,Camille Rowe Explores Fitness & Movement (Clip 5) | What on Earth is Wellness? | British Vogue,70269,2016-09-06T15:42:25Z
obWumrbBXtE,Camille Rowe Explores Meditation & Community (Clip 4) | What on Earth is Wellness? | British Vogue,31649,2016-08-30T14:21:44Z
oT_QTImmUHc,Camille Rowe Explores Psychology & Mindfulness (Clip 3) | What on Earth is Wellness? | British Vogue,61404,2016-08-23T13:35:15Z
_u86npjGe7w,Bella Hadid’s Jet-Lag Beauty Guide | Beauty Secrets | Vogue,15414901,2016-08-22T13:00:45Z
Fq_ZlF3pDmU,Camille Rowe Explores Nutrition & Supplements | What on Earth is Wellness? (Clip 2) | British Vogue,62557,2016-08-17T10:00:01Z
lsFPbgK1v9I,73 Questions With Kendall Jenner | Vogue,49849895,2016-08-16T13:00:50Z
aWhFs0ndDsM,Victoria Beckham’s Five-Minute Face | Beauty Secrets | Vogue,7300154,2016-08-15T13:00:30Z
VofXC2nT1v8,Olympic Wrestler Helen Maroulis Fights Like a Girl | Vogue,152298,2016-08-10T14:14:00Z
dGVJIMz7Qww,Camille Rowe’s Journey Towards Wellness | What on Earth is Wellness? (Clip 1) | British Vogue,101769,2016-08-09T14:42:40Z
8Jd-DAVjfL4,Olympian Daryl Homer Shows You What Pro Fencing Is Really Like,49444,2016-08-09T13:51:31Z
MASdI8MhvSw,Victoria’s Secret Model Izabel Goulart’s Rio Walking Tour | Vogue,148324,2016-08-05T13:24:55Z
5SqP7Nb93BY,Camille Rowe asks What on Earth is Wellness? (Series Trailer) | Vogue,106077,2016-08-02T14:00:00Z
I8ktbz585t4,16 Steps to Looking Like a K-Pop Star With Jessica Jung | Beauty Secrets | Vogue,7328748,2016-08-01T13:01:03Z
ao876ahel1g,Céline Dion on Her Titanic Sweatshirt and 5 More Surprising Choices | Vogue,233627,2016-08-01T10:00:59Z
Gpu_st4ynLc,73 Questions With Serena Williams | Vogue,4027634,2016-07-28T13:00:46Z
eQ62tOo0FPQ,Supermodel Gigi Hadid Does Los Angeles Like You’ve Never Seen Before | Vogue,9247288,2016-07-21T12:02:17Z
HtF-UWOwges,Watch French It Girl Soko’s Trick for the Ultimate Moody Eyeshadow | Beauty Secrets | Vogue,710648,2016-07-19T16:06:43Z
QWqiIYMZkpI,Skate New York With the City’s Coolest Crew | Vogue,53177,2016-07-15T13:00:34Z
JRqRbR1-Tjc,"Gigi Hadid and Olympian Ashton Eaton Film With A Selfie Stick, Watch What Happens | Vogue",208204,2016-07-14T12:10:15Z
HMyYp9faGvU,Easy Black-Tie Beauty With Sofía Sanchez de Betak | Vogue,782449,2016-07-11T15:39:26Z
-3tDvMG87Ro,"Rodney Mullen Debuts New Tricks, Captured in 360 Degrees | Vogue",2024510,2016-07-11T13:00:23Z
9PxTyLYtudM,Healthy Pea Salad for Summer | Vogue,67071,2016-06-29T16:58:39Z
ynakjV77kZk,South Korean Longboarder Ko Hyojoo Rolls Through Seoul in Style,2394252,2016-06-27T17:13:37Z
yBDm8c-66mA,Thom Browne | Spring 2017 Menswear,15103,2016-06-27T14:49:51Z
lNpXMoTO2Os,Balmain | Spring 2017 Menswear,24878,2016-06-26T18:31:13Z
jveJ4jT7To0,Givenchy | Spring 2017 Menswear,19560,2016-06-25T14:04:18Z
b7nB8yVZsd0,Rick Owens | Spring 2017 Menswear,13388,2016-06-24T21:58:35Z
hFLgLsGmXOM,Louis Vuitton | Spring 2017 Menswear,23400,2016-06-24T20:40:14Z
PYFo7U_VMYE,Balenciaga | Spring 2017 Menswear,19147,2016-06-23T15:54:48Z
6GNmQypUVM8,"Style, the Oaxaca Way | Vogue",100877,2016-06-22T14:00:19Z
VMvRkIlJVis,Easy Raspberry Jam,152253,2016-06-22T13:00:22Z
z5vRFgWywhY,Learn the Secret Ingredient to the Perfect PB+J Sandwich,80114,2016-06-22T13:00:20Z
Av1v9eQuBbw,Model Carlotta Kohl's Perfect After-Dark Beauty Look | Beauty Secrets | Vogue,440539,2016-06-20T13:00:36Z
A1J15WE9QmI,Model Style the Festival Way,66413,2016-06-17T23:23:48Z
lcyokadl-cY,"36 Hours With Ashley Graham, Supermodel! | Vogue",1691430,2016-06-17T13:00:35Z
5Av3ZKrDxKM,Amy Schumer and Anna Wintour Swap Lives | Vogue,4419803,2016-06-16T12:22:13Z
ptNH5nhmErM,Desiigner Takes “Panda” to Wall Street With Model Andreea Diaconu | Vogue,275529,2016-06-14T13:00:35Z
q1GdvcMsiWk,"Tyler, The Creator’s Fashion Show Was Unlike Anything You’ve Ever Seen",1283564,2016-06-13T13:00:15Z
9yPIBp5H6XQ,"Katy Perry, Caitlyn Jenner, Cindy Crawford, and More Get Groovy at Moschino's L.A. Show",109880,2016-06-11T23:59:22Z
2AjAToIfEPc,73 Questions With James Corden | Vogue,8080052,2016-06-09T10:00:40Z
H2QA9mtcY5k,Broad City’s Abbi Jacobson and Ilana Glazer Get Red Carpet–Ready With Rebecca Minkoff,20917,2016-06-08T21:05:29Z
77273Fhle9w,3 Steps to the Perfect Breakfast Sandwich | Vogue,451979,2016-06-08T15:31:14Z
PuTTwak1B48,"The Myth Of Orpheus and Eurydice, Part Two: The Bliss | Vogue",232319,2016-06-06T14:01:59Z
k7oIqRybads,"The Myth Of Orpheus and Eurydice, Part Three: The Descent | Vogue",179274,2016-06-06T14:00:43Z
ytuRuFgMGe0,"The Myth Of Orpheus and Eurydice, Part Four: The Petition of Hades | Vogue",131299,2016-06-06T14:00:43Z
v-U5c38WhrA,"The Myth Of Orpheus and Eurydice, Part One: The Wedding | Vogue",327223,2016-06-06T14:00:42Z
TpROMj33b4g,How to Get the Ultimate Beach Wave Hair With Model Cami Morrone | Beauty Secrets | Vogue,965394,2016-06-06T13:25:28Z
jJiWkbXcZ6w,Lena Dunham Tries Meditation | Vogue,180784,2016-06-01T16:40:11Z
QGglW8yvbwU,Inside Serena and Venus Williams’s Secret Dance Competition | Vogue,122464,2016-05-27T11:00:28Z
85rco5-Xmtw,"Kate Upton, Kate Upton, and Kate Upton Had A Dance Party | Vogue",18035,2016-05-26T18:00:19Z
HbAH3XzRRRc,Cannes Winner Xavier Dolan Talks Adele and Movies Without Happy Endings,133844,2016-05-24T19:14:44Z
qgliTNCiP0Q,Inside Kanye West’s Life of Pablo L.A. Merch Store,69809,2016-05-23T20:07:38Z
