VideoID,VideoName,Views,UploadDate
tD3PVJ6yaQU,Nicki Minaj Worked at Red Lobster 🦞 When Her Song Hit the Radio,47970,2023-11-10T17:00:08Z
WrN3Dx3EBVI,73 Questions With Nicki Minaj | Vogue,3809243,2023-11-09T13:00:01Z
8SjV21-odIM,"Karlie Kloss Breaks Down 15 Looks, From Victoria's Secret to the Met Gala | Life in Looks | Vogue",179088,2023-11-08T17:00:10Z
0W00XE9Mr-0,Kylie Jenner's Ideal Look for Dropping Off the Kids at School,1013390,2023-11-07T17:22:17Z
c8tJCprErC8,Linda Evangelista & Marc Jacobs Reminisce on ’90s Fashion | Vogue,99437,2023-11-03T16:00:05Z
509_aH_oByM,Katy Perry Reveals Why She Was Late to the Met Gala,92819,2023-11-02T14:57:42Z
xcczd0gtA8o,"Emily Ratajkowski Opens Up About Her Body, Dating & Divorce | Vogue",202262,2023-11-01T18:12:20Z
C1sejqEVAH4,Kendall Jenner & Corey Gamble Wonder Where the 818 Bottle Is,81684,2023-10-31T16:00:17Z
Q7kzYccRTiA,Emma Chamberlain Separates an Egg Like a Pro,69133,2023-10-26T19:44:20Z
eDyWarerD-A,Inside the Home of Ganni's Creative Director | Vogue,243370,2023-10-25T16:00:13Z
zISMyl2NxvU,Kim Kardashian's Unique Black & Cream Basketball Court,575101,2023-10-24T19:54:33Z
6y7t7RYphzk,Spanish Actor Ester Expósito's Weekend Makeup Routine | Beauty Secrets | Vogue,603817,2023-10-23T16:00:02Z
XUMepazBhMg,Celebs Show Off Their Eye Masks,124558,2023-10-20T20:29:09Z
fMOt1i1MlQY,"Asking Kendall Jenner About Her ""Roman Empire""",318528,2023-10-19T20:40:44Z
139vBGTA6fo,"Inside the Home of Alaïa's Creative Director, Filled With Wonderful Objects | Vogue",263749,2023-10-19T16:00:09Z
GmOWJVnGPtA,Vogue’s Search for the World’s Next Top Model,191428,2023-10-18T16:00:07Z
WR9SoZ7zadk,Model Amelia Gray's 12-Step Skin Care Routine and Double Blush Makeup Look | Beauty Secrets | Vogue,263931,2023-10-17T16:00:05Z
YmHg5p1rbx8,Backstage With Kendall Jenner During Fashion Month | Vogue,700638,2023-10-16T16:00:01Z
lzZ-Wxi1Vjg,No One Chops Faster Than Cardi B,98696,2023-10-13T16:00:11Z
ude6nE0-3Qc,"Alia Bhatt's ""Going Out"" Skin Tint Advice",609888,2023-10-12T16:00:19Z
ZGGaZNBmwvY,73 Questions With Gwyneth Paltrow | Vogue,733468,2023-10-09T16:00:05Z
QpWbKHd8nz8,Sofia Richie Grainge Had an Emo Stage,307067,2023-10-06T19:18:53Z
hzOg6IfQaoQ,Nessa Barrett's Guide to Acne-Prone Skin Care & '90s Glam | Beauty Secrets | Vogue,484698,2023-10-06T16:00:01Z
d4iCsjii-3Q,9 Hours in Milan With Hunter Schafer | Vogue,460265,2023-10-05T16:00:19Z
bvbN10KyuEg,Ariana Grande's Cat Eye Secret Revealed,2806603,2023-10-04T20:47:15Z
2KX2U0z_Xcc,"Ginger Spice Breaks Down 11 Looks, From Spice Girls to F1 | Life in Looks",429673,2023-10-04T16:00:09Z
xnwKgf4wMnI,Kendall Jenner Arrives at Gucci!,290952,2023-10-04T00:00:02Z
kHJveEQfi3Q,Mimi Keene's Smile Lines Makeup Trick,621503,2023-10-03T22:05:07Z
o_SM8O-Eho4,Jenna Ortega Makes a Statement at the Dior Show,172894,2023-10-02T16:00:11Z
KeEvU3jogoM,Cardi B Cooks With Vogue,1091203,2023-10-02T16:00:03Z
-M5oo7G3PUI,Out of this World Dresses at Fashion Week,149288,2023-09-29T21:00:01Z
Gg7lhyz04do,Kylie Jenner Arrives at the Acne Studios Show,184895,2023-09-29T19:00:01Z
jpDutGntqm8,Kendall Jenner Stuns in Schiaparelli,361681,2023-09-29T18:19:05Z
9Bo61gPuZM4,"Irina Shayk, Adut Akech, Vittoria Ceretti & More Model Lingerie on the Dolce & Gabbana Runway",91431,2023-09-28T20:00:03Z
uW69rt6WBro,Naomi Campbell Rocks the Dolce & Gabbana Runway,56480,2023-09-28T19:00:03Z
lzmmGyNa4RI,The Star-Studded Fendi Front Row ✨,674034,2023-09-28T17:32:41Z
DKL6yw2-Yk4,How Moroccan Model Rania Benchegra Gets Runway Ready | Diary of a Model | Vogue,323058,2023-09-28T16:00:10Z
cB5Zwz1pv60,My First Day Walking the Runway - Diary of a Model | Vogue,315213,2023-09-27T16:00:08Z
WcG5BLvhBps,Alia Bhatt's First Time in Milan!,741601,2023-09-23T00:00:02Z
oL1J6urCyy0,"Nicola Coughlan's ""Theater Curtain"" Harris Reed Headpiece",56278,2023-09-22T16:00:13Z
q9q6tST99Do,It's Like Maude Apatow Is Getting Married 👰,74698,2023-09-22T13:00:05Z
YzLZSrV75kI,Makeup Artist Pat McGrath's Masterful Lipstick Trick,100905,2023-09-21T16:00:11Z
Oam14CEEsEM,Taylor Zakhar Perez Tries on His Vogue World Look,52600,2023-09-21T13:50:12Z
5BWzqAhip6w,Charithra Chandran Shines on the Red Carpet✨,74476,2023-09-20T20:27:00Z
W0bTqphy3lo,FKA Twigs 🔥 at Vogue World,58327,2023-09-20T17:50:48Z
BpRrE7M0K3Y,"Sex Education's Mimi Keene on Her ""Shaky Shaky"" Mascara Method | Beauty Secrets | Vogue",1013493,2023-09-20T16:00:19Z
PxtHzPuyNTE,7 Beyonce-Inspired Looks at the Renaissance Tour | Vogue,43056,2023-09-19T16:00:23Z
QALeIh_Q-UI,When Cole Met Harry Styles' Stylist Harry,128849,2023-09-19T16:00:15Z
g9qYz3JT0Iw,It's Skirt Season At NY Fashion Week,62167,2023-09-19T14:08:30Z
NCbl4Nr5DDo,Emma Watson Reads Tarot Cards,113823,2023-09-18T22:00:02Z
I7bd6uZ8WiQ,Burna Boy Arrives at the Burberry Show,22516,2023-09-18T20:47:06Z
J-WET2PF_js,How Makeup Artist Pat McGrath Creates an Iconic Look | Vogue,104083,2023-09-18T16:00:11Z
uY_2uVkxJ8U,'60s Supermodel Twiggy Recreates a Classic Photo - 56 Years Later,4057779,2023-09-18T16:00:03Z
OYn4p2neevE,"Stormzy Performs ""Crown"" at Vogue World: London",39486,2023-09-17T10:35:26Z
CqsCtzaF_YA,Maude Apatow Gets Ready for Vogue World: London | Vogue,110350,2023-09-16T18:00:03Z
uVd6uakVUe8,Nicola Coughlan Gets Ready for Vogue World: London | Vogue,147559,2023-09-16T15:00:02Z
iRxhfVEfYBE,Cole Sprouse Gets Ready for Vogue World: London | Vogue,115878,2023-09-15T23:31:48Z
L1ENoMOyRbY,Taylor Zakhar Perez Gets Ready for Vogue World: London | Vogue,395071,2023-09-15T19:45:01Z
Z1eUJ6N-QBE,Kate Moss Opens Vogue World: London and Takes the Audience to Another World,61607,2023-09-15T02:30:36Z
CIJsZWeCz7A,FKA Twigs Performs “It’s a Fine Day” at Vogue World: London,239204,2023-09-15T02:20:26Z
jUPqitGs-F8,"Supermodels Naomi, Cindy, Linda & Christy Stun the Vogue World Crowd",137776,2023-09-15T02:05:09Z
NIJs5PycpxU,The Best of the Vogue World: London Red Carpet,101550,2023-09-15T01:52:04Z
RGLsmIVgAo8,Annie Lennox Performs “Sweet Dreams (Are Made of This)” at Vogue World: London,174602,2023-09-15T00:57:04Z
oWfius0mvkY,"Supermodels, Annie Lennox,  FKA Twigs & More Celebs Take the Stage at Vogue World: London",482904,2023-09-14T19:56:52Z
yA79KYMLUpI,Inside Emma Watson's Prada Backpack | In The Bag | Vogue,3027252,2023-09-14T15:00:18Z
oUlh9GJ7-6g,Celebs on the Move! Golf Cart Travel is All the Rage During Fashion Week,57412,2023-09-14T13:00:01Z
KZjjEJBeBRE,Vogue World: London - TOMORROW!,20976,2023-09-13T19:00:05Z
U3-9gjUfLtA,24 Hours With Simone Ashley | Vogue,362226,2023-09-13T16:00:18Z
4dqdcXavf68,Blake Lively Stuns at the Michael Kors Show During NYFW,3571811,2023-09-13T16:00:10Z
gmSz8YTJWfE,What Do Models Think About on the Runway?,82297,2023-09-13T14:08:44Z
6tItPSWq_1s,Ariana Grande & Hailey Bieber Love Each Other's Products,3953508,2023-09-12T21:18:05Z
pJMoouN9qCM,Ariana Grande's Button Nose Makeup Trick,4972919,2023-09-12T18:08:27Z
MdLcP8dJls4,Ariana Grande's Skin Care Routine & Guide to a ‘60s Cat Eye | Beauty Secrets | Vogue,5044755,2023-09-12T16:00:20Z
zcW1w__cx_U,Kate Winslet on the Story of Lee Miller,70130,2023-09-12T00:00:03Z
Z4Q7Dy93xks,Priyanka Chopra Jonas on the Best Part of Fashion Week,124674,2023-09-11T22:16:16Z
mS3dgrh-qbU,How Priyanka Chopra Jonas Puts Together the Perfect Concert Outfit,490700,2023-09-11T18:43:24Z
raQkSO5-2LQ,"Kate Winslet Talks Ice Baths, Raising Chickens, and Her New Film | Vogue",422226,2023-09-11T12:00:01Z
nmSGfdhnPOU,"Vogue World: Next Stop, London",54399,2023-09-10T14:00:02Z
lqADHk9Ym6A,Kaia Gerber Just Might Have a Wardrobe Malfunction,286866,2023-09-08T18:20:01Z
lKm9weFP8A8,Zendaya on Tom Holland & Jake Gyllenhaal,126371,2023-09-07T19:23:02Z
8C2J9Ij7K5Y,That Time Anne Hathaway Ended Up on the 'Worst Dressed' List,386111,2023-09-07T18:10:00Z
QudAbrfHXjg,"Alia Bhatt: ""He Told Me, Do Not Touch Your Brows!""",2644797,2023-09-06T21:10:32Z
KBaBxVBedfo,Vogue Open Casting: Who Could Be the World's Next Top Model?,52852,2023-09-06T20:06:19Z
DTMOaJuY7BY,What Are People in South London Wearing? | Vogue,87705,2023-09-06T16:00:12Z
Tc5e182BjEs,Debbie Ryan's Depuffing Secret,1217319,2023-09-01T16:00:05Z
qi-pltCKjSs,A Horse Licks Kendall Jenner's AppleSkin Stella McCartney Bag,120125,2023-08-31T16:22:05Z
4Ql-HTkW33U,"""Practice is the Reason Why I've Gotten to This Level"" - Coco Gauff",46763,2023-08-30T21:00:03Z
cLUETcxb9eY,Anne Hathaway's MUST HAVE Beauty Items,1150377,2023-08-30T19:00:02Z
4cWyLPidWcA,TWICE's JIHYO on Skin Care & Soft Blush Makeup | Beauty Secrets | Vogue,2328867,2023-08-30T16:00:09Z
BqHv4iTUgqg,The Summer I Turned Pretty's Lola Tung Answers: Team Conrad or Jeremiah?,140163,2023-08-29T20:38:27Z
CP9POk-vJCY,Anne Hathaway Answers 7 Questions | Vogue,462488,2023-08-29T16:00:25Z
fKFFLx_zCxw,Blake Lively Talks Gossip Girl's Impact on Fashion,1300723,2023-08-29T13:56:40Z
M7oVTf2GEfg,This Fendi Bag Opened the Floodgates for Sex and the City,56451,2023-08-25T19:00:02Z
Kcd8WZBQ_yo,Tips For Starting a Wardrobe From a Vogue Editor,44156,2023-08-25T13:00:03Z
0MDvFLdGi_M,Alia Bhatt Wishes She Had Lashes Like Ranbir Kapoor,6632400,2023-08-24T16:00:09Z
ClxMAcEykHg,#VogueWorld Is Coming to London This Fall,34425,2023-08-24T13:00:03Z
i4UDQ_Izeto,"Legends! Supermodels Naomi, Cindy, Linda & Christy Reunite",297335,2023-08-23T16:00:05Z
fSCTEPFF42A,Madison Beer Goes Vintage Shopping,129895,2023-08-22T19:00:03Z
VEukPLK9NFM,24 Hours With Madison Beer | Vogue,641799,2023-08-22T16:00:22Z
g999vkhe_-c,"""I Literally Dunk My Face in Ice!"" Alia Bhatt’s Guide to Ice Water Facials",15235547,2023-08-21T16:48:20Z
9vqVKSyCG0E,Kylie Jenner Is Too Distracted to Cook,215816,2023-08-18T13:00:02Z
x_AMIW_94v0,24 Hours With TXT (투모로우바이투게더) | Vogue,308391,2023-08-17T16:00:08Z
HiKajEMHBUM,Emma Chamberlain Is Quite Thirsty🥤,270819,2023-08-17T13:00:02Z
Ru9nUATkDWk,How to Walk Like a Top Model,287590,2023-08-16T13:00:01Z
EK5PaQeWdS8,The Weird Way Alia Bhatt Applies Her Lipstick,13255004,2023-08-15T21:00:02Z
aaPV4S_677c,Shawn Mendes Wanted to Be a Photographer...Until...,89515,2023-08-15T13:00:01Z
8uQ8fv8y5Vg,Alia Bhatt's Guide to Ice Water Facials & Foundation-Free Makeup | Beauty Secrets | Vogue,3466686,2023-08-15T12:00:03Z
-FBXFVM-S5A,Kylie Jenner's Eyebrows Fell Off?,920293,2023-08-14T13:00:03Z
vtbL8AsZWUQ,"Adele Sings ""Hello""...Like a Chipmunk?",312093,2023-08-11T16:00:05Z
szKr8eikWv0,"Naomi, Cindy, Linda & Christy: The Return of the Supers - Behind the Scenes of the September Issue",886194,2023-08-11T13:34:01Z
Sg05xpZaPPo,Kylie Jenner's Mom Just Let Her Be Herself,268397,2023-08-10T13:00:03Z
D3QxQAsRW_Y,Ayesha & Stephen Curry Get Ready Together ❤️,121525,2023-08-09T19:00:02Z
mB_CyPhuxMo,Alycia Debnam-Carey’s 11-Step Skin-Care Routine & Bronzed Makeup Look | Beauty Secrets | Vogue,268243,2023-08-09T16:00:19Z
ALzcWh7gJIE,Kendall Jenner Was a Huge Tomboy,184066,2023-08-08T13:00:01Z
ziyFHoCR128,Gigi Hadid is Now a Skirt Person,292471,2023-08-07T13:00:03Z
AwxPCO4hvIQ,Hailey Bieber Wishes Margot Robbie Was Her Celeb Look-alike,875702,2023-08-04T13:01:02Z
BsWrxrCFTCs,"""I Wanted to Play Regina!"" Lindsay Lohan on the Story Behind ""Mean Girls""",119985,2023-08-03T13:00:02Z
GyyRWG2-BAo,Little Mix’s Leigh-Anne's Newlywed Date Night Glam | Beauty Secrets | Vogue,158983,2023-08-02T16:01:06Z
RSdg_U93DMM,Mindy Kaling Loves a Good Workout,55183,2023-08-02T14:15:20Z
PgrRq0MD3rw,The  Kardashian / Jenner Family Answer: Who Is Most Likely to Get Lost?,173509,2023-08-01T20:53:34Z
MFn2ASe6xDQ,Paramore's Hayley Williams Gets Ready For Her LA Concert | Vogue,575818,2023-08-01T16:00:18Z
bCjaTavqr4c,Gigi Hadid's Barbie!,236342,2023-08-01T13:24:30Z
3ARm-3ROoDs,Sofia Richie Grainge: Being Married is the Best!!,218475,2023-07-28T19:00:05Z
6yr0cDoakJs,Celebs Reveal Their Skin Care Routines,89272,2023-07-28T16:00:04Z
XGMxVFIaR8M,Khloé Kardashian Bought Justin Bieber's House,736824,2023-07-28T14:34:55Z
T2EXmjUpugE,Sofia Richie Grainge's Workout Routine 🏋️‍♀️,742879,2023-07-27T23:00:01Z
X1RyB_41kEw,"Which ""The Summer I Turned Pretty"" Cast Member Would Be Late to Set? #thesummeriturnedpretty",491837,2023-07-27T20:55:39Z
-KMgA0Jg1iI,SLAY 💅,117839,2023-07-27T19:00:03Z
SaOc3Bf4ldg,"Selena Gomez Still Loves ""Love You Like a Love Song""",305147,2023-07-27T13:00:02Z
YnchKoHz_jc,BTS's Jung Kook Answers Questions at Good Morning America 🩷 #전정국,224020,2023-07-26T19:00:04Z
ekYr8i9cvNA,Mindy Kaling's Girls' Night Out Glam | Beauty Secrets | Vogue,180161,2023-07-26T16:00:04Z
Iu5bKsNSsa8,How Gisele Bündchen Defines Beauty,129441,2023-07-26T14:41:08Z
mXuenYPkynA,"""Oh, It's Bad!"" Selena Gomez on Her Old School Style",187270,2023-07-25T19:00:02Z
0HnOMLW_HxM,24 Hours With Sofia Richie Grainge | Vogue,1802149,2023-07-25T17:13:08Z
aOtZcrUD2BI,Kendall Jenner on Her Skin Journey,121576,2023-07-25T13:00:03Z
UXu1Vn4-7W0,Barbara Palvin's Fairytale Wedding to Dylan Sprouse,194046,2023-07-24T20:08:39Z
JcmCETsWAcw,Is Margot Robbie a Method Actor?,699715,2023-07-24T19:00:02Z
sm7pzKdSrzg,Inside RHONY's Jenna Lyons's SoHo Apartment Filled With Wonderful Objects | Vogue,545811,2023-07-24T16:00:05Z
9Wf3IyFG3TI,Barbie's Margot Robbie Plays True or False,240700,2023-07-21T19:52:02Z
WU8UynM9JaE,"Hailey Bieber's Cute, Practical ""Going Out"" Look",1865721,2023-07-21T18:04:50Z
e3pw82z0RMQ,Barbie's Issa Rae Shares Her Dry Skin Routine | Beauty Secrets | Vogue,351502,2023-07-21T16:00:03Z
pGYw-Cvm_Vk,Cardi B Would Travel the World for a Birkin Bag,157739,2023-07-21T13:38:29Z
zPys5ZYL-ng,Milan Street Style: What Are People Wearing? | Vogue,98382,2023-07-20T16:00:04Z
3fzetHd9OCo,Inside Designer Thom Browne's Showroom,26653,2023-07-19T13:00:03Z
sJ1SR2A7xcY,🥚 Can Priyanka Chopra Jonas Crack an Egg? 🥚,231069,2023-07-18T20:49:23Z
nDhHN_bDqUY,Olivia Colman Won't Leave Her House Without What? 😲,165110,2023-07-18T13:00:06Z
pJGVqJL75Kc,Celebs Reveal Their Acne Routines,149906,2023-07-17T16:00:12Z
icvZ-17Vso0,Barbiecore Street Style at Couture Fashion Week 🩷,82049,2023-07-14T14:31:13Z
HuMW_U27gyE,Lola Tung Learned Skin Care While Filming The Summer I Turned Pretty,94018,2023-07-13T22:00:03Z
u-voLtzDD9Q,The Summer I Turned Pretty's Lola Tung Shares Her Berry Lip | Beauty Secrets | Vogue,2086822,2023-07-13T16:00:12Z
m3t4oBOKMN4,Emilia Clarke: If Daenerys Targaryen Had a California Accent 😂,317958,2023-07-13T13:52:59Z
Wtq_T1bFN1w,Hari Nef's Barbie Vibes are Immaculate,70764,2023-07-12T22:00:02Z
EXIW5zIdFqU,Emilia Clarke & Olivia Colman Ask Rapid-Fire Questions | Off the Cuff | Vogue,946254,2023-07-12T16:00:07Z
S2owqFTmORQ,"Olivia Rodrigo on What ""drivers license"" Means to Her",98361,2023-07-11T20:13:31Z
e-HZ2TIVULI,A Day in the Life of Fashion Designer Thom Browne | Vogue,233750,2023-07-10T19:58:03Z
LC80Tf1xQSI,Makeup Artist Isamaya Ffrench Reveals Her One MUST Beauty Secret,99241,2023-07-07T19:00:03Z
G1FLUuDKRYI,73 Questions With Olivia Rodrigo | Vogue,4257891,2023-07-07T12:00:01Z
MxA2UaUAahc,Celebs Reveal Their Fave Facial Tools,847304,2023-07-06T13:00:03Z
ENfKYbc797E,Cardi B Gets Ready for the Schiaparelli Show | Vogue,393006,2023-07-05T22:29:04Z
wZNkI6YGEys,Lindsay Lohan Explains Her MTV Movie Awards Look,54971,2023-07-05T13:00:02Z
MgnYhX85OwI,Usher's Pre-Show Skin Care and Wellness Routine | Beauty Secrets | Vogue,393046,2023-07-03T16:00:19Z
AU3ECrLkLUE,Cardi B Arrives at Schiaparelli's Couture Show,53895,2023-07-03T15:21:38Z
rLGEdHNHYNc,Model Anok Yai Begs Pat McGrath for This ONE Makeup Trick --- Every Time!,64915,2023-06-30T16:57:02Z
u9oPmqPiGq4,"What Are People Wearing In Brooklyn, New York? | Vogue",176980,2023-06-30T16:00:13Z
Rhy1XbAeJSI,Camila Mendes Explains How She Went From Acting School to Riverdale,76449,2023-06-29T16:30:07Z
IQ6C05j7z9U,How Designer Prabal Gurung Made Model Anok Yai's Met Gala Dress,53176,2023-06-28T19:00:02Z
kniI-LPlni0,La La Anthony’s Guide to Crease-Free Concealer & Bronzed Makeup | Beauty Secrets | Vogue,215285,2023-06-28T16:00:12Z
Toz_thhuK5c,Khloé Kardashian on Why She Named Her Baby True,521113,2023-06-28T13:20:31Z
F763plsQC2U,"Every Outfit Barbie's Hari Nef Wears in a Week | 7 Days, 7 Looks | Vogue",119614,2023-06-27T16:00:05Z
Ze0oysOTluU,Jacob Elordi: How Heath Ledger Inspired Me to Act,59303,2023-06-26T19:00:03Z
xEQUfj4BVfg,Tina Turner's 12 Most Iconic Looks From 1964 to 2019 | Life in Looks | Vogue,87507,2023-06-26T16:00:14Z
XXH9Zzac6DE,Maluma Gets Ready for Pharrell’s Louis Vuitton Show | Vogue,195779,2023-06-23T16:00:05Z
Al0LtHJ1EZc,Gigi Hadid Reveals Her REAL Name,680597,2023-06-23T13:00:02Z
LgKfl1K0uFI,"Kylie Jenner ""The Majority of the Time I'm NOT Wearing Makeup""",618448,2023-06-22T18:09:47Z
6ysh5TcVpBc,25 Years of Sex and The City: Sarah Jessica Parker's Ultimate Tribute | Vogue,394286,2023-06-22T13:00:01Z
ylQSbbA5N34,"Kim Kardashian, Gigi Hadid and More Speak at Vogue's Forces of Fashion",64660,2023-06-21T18:34:09Z
o9yT_UJQfHU,Erykah Badu Was Blown Away 🤯 By Her Vogue Cover,50931,2023-06-21T14:29:19Z
fnb0sEQMiKU,Joe Jonas Sings a Vogue Theme Song,33047,2023-06-20T21:28:17Z
EHJ303zwfEM,A First Look at Pharrell Williams’s Louis Vuitton Men’s Debut Collection | Vogue,498139,2023-06-20T19:30:02Z
fskGZO1Q0Uk,Alexis Ren's Romantic Beauty Look,66011,2023-06-16T16:00:16Z
iFS7U2qHLb4,Cruel Summer Star Lexi Underwood’s Guide to Girls-Night-Out Makeup | Beauty Secrets | Vogue,102702,2023-06-15T16:00:22Z
rpJuYJnnxXY,Margot Robbie on Embodying Barbie for the Big Screen,1247039,2023-06-15T13:00:01Z
fclciPOYWF0,Gigi Hadid Is Vittoria Ceretti's Assistant for the Day,132615,2023-06-14T13:00:03Z
xYUtklZ9JGs,Emily Ratajkowski's '90s Makeup Trick,102683,2023-06-13T13:00:02Z
J3S7pweXtkA,What's Our Favorite Carrie Bradshaw Look?,542329,2023-06-12T14:43:30Z
MX6dMQXdJe4,Padma Lakshmi Reveals Her Secret Honey Trick,70280,2023-06-09T13:00:01Z
-TTD6XjuNeM,Erykah Badu Breaks Down 11 Looks From 1997 to Now | Life in Looks | Vogue,452438,2023-06-08T16:00:02Z
p6HxnL42bLI,Watch Priyanka Chopra Make a Bowl of Cereal,819775,2023-06-08T13:00:03Z
Pv1Z-48dKLo,Troye Sivan Was Nervous Before Meeting Lily-Rose Depp and Jennie,108935,2023-06-07T19:00:02Z
BOVUEoarYU4,"Lip Gloss or Lipstick? Hailey Bieber, Emma Chamberlain, Rihanna an More Weigh In",992668,2023-06-07T14:53:58Z
-vrxI66fgcQ,Designers Stella McCartney & Shie Lyu Reinterpret Each Other’s Work | Vogue,102426,2023-06-05T11:00:02Z
ASDofsLAj_w,Lily-Rose Depp Taught Troye Sivan How to Pose on the Red Carpet,876336,2023-06-02T13:00:01Z
pcEgehAd2u0,Victoria Beckham Catches the Bus,98650,2023-06-01T19:00:02Z
UMhzJmmP728,Fashion Icon Naomi Campbell Returns to Where it Started,76026,2023-06-01T16:47:41Z
rQw8QYv1m2Q,'This is my Krispy Kreme Hat!' Inside Yara Shahidi's Prada Backpack | Vogue,137849,2023-06-01T16:00:21Z
MxOD6aYSKeM,Outer Banks Star Carlacia Grant’s Guide to Supermodel Glam,70339,2023-06-01T00:30:03Z
9GMCuPLrNwM,"Kylie Jenner's Beauty Routine ""Thin Brows Are In!""",1478719,2023-06-01T00:00:04Z
nEVY2PXkI7M,The Biggest Moment of Gigi Hadid's Career,460407,2023-05-30T20:49:28Z
zf8jeA-2NpY,Sofia Richie Married the Man of Her Dreams,186971,2023-05-27T18:20:58Z
3H6imj4vhwY,"Troye Sivan Gets Ready for ""The Idol"" Premiere | Vogue",230220,2023-05-26T16:00:06Z
xQKbKUWWoxw,Billie's Met Gala Hair & Dress Worked in Perfect Harmony,98980,2023-05-25T19:00:01Z
t0OsW8M-owE,Alexis Ren's Guide to Face-Lifting Romantic Makeup | Beauty Secrets | Vogue,308324,2023-05-25T16:00:23Z
GFrw11vay9k,Priyanka Chopra's Daughter Eats Just Like Mom,27521721,2023-05-24T20:03:02Z
LAz1ATucm3Q,"Margot Robbie Breaks Down 15 Looks, From The Wolf of Wall Street to Barbie | Life in Looks | Vogue",2463110,2023-05-24T12:01:04Z
onTAocTAfLk,Jennifer Lawrence ❤️ NY,154248,2023-05-23T17:51:11Z
EJya33R0wZI,Alia Bhatt Arrives at the Gucci Cruise 2024 Fashion Show,10155906,2023-05-22T19:01:01Z
u_kFNzvdCqA,Alia Bhatt Gets Ready For Her First Fashion Show,13447244,2023-05-22T16:04:23Z
N9uigKKg968,"Jack Harlow & Emma Chamberlain ""Love ya!""",6705563,2023-05-19T13:00:04Z
yfNpEWZyFTE,Priyanka Chopra Jonas Makes a Three-Course Brunch | Vogue,5373372,2023-05-19T11:00:01Z
lrl9gyw03tg,"Bad Bunny: ""Men, the more they age, the better they get.""",255057,2023-05-18T13:01:02Z
Wk9SzsPJz9Y,Phoebe Tonkin's Guide to Heatless Curls and Red Lipstick | Beauty Secrets | Vogue,691948,2023-05-17T16:00:10Z
sx2KCPTbXe4,Doja Cat Speaks in Meows With Emma Chamberlain 😹,840390,2023-05-17T13:00:02Z
AiW_-v4pc8U,Ice Spice is Ready to Take Pictures at the Met,393879,2023-05-16T13:00:02Z
wE5ER5yMrns,Brooke Shields Breaks Down Richard Avedon's Most Iconic Photos | Life in Looks | Vogue,127064,2023-05-15T16:01:02Z
fppMYF3aAMs,Billie Eilish & Emma Chamberlain Hang Out at the Met,3699516,2023-05-15T13:09:01Z
Eq8dom1UbnQ,Alia Bhatt & Priyanka Chopra Jonas's Met Gala Bond,2441927,2023-05-12T16:00:06Z
JEvkpz8mcUQ,Dua Lipa Inside the 2023 Met Gala,157753,2023-05-12T13:00:02Z
fAMh2muEwFc,Jenna Ortega Tries on Her Met Gala Dress,109176,2023-05-11T18:00:03Z
6zpR_K71n58,Young Lady Danbury Actor Arsema Thomas's Night-Out Makeup Look | Beauty Secrets | Vogue,318791,2023-05-11T16:00:02Z
MFglQT_wuxo,Priyanka Chopra Jonas & Nick Jonas Inside the 2023 Met Gala,364142,2023-05-11T13:00:02Z
OsMm148XMAk,Kate Moss Inside the 2023 Met Gala,85538,2023-05-10T16:00:10Z
O3mFDd8Q2W8,24 Hours With Jonas Brothers | Vogue,699644,2023-05-10T16:00:06Z
jdJbuqDto-k,Billie Eilish on Balancing Her Masculine & Feminine Sides,2663220,2023-05-10T14:21:22Z
CGfjYsL8gMU,Sydney Sweeney Inside the 2023 Met Gala,111316,2023-05-09T21:30:51Z
CioAze3qa-M,Karl Lagerfeld’s Legacy in Fashion | Vogue,164696,2023-05-09T17:02:50Z
Q5UgNaoixG0,"Alia Bhatt: ""I Should Be Like a Ball of Blush!"" at the Met",184927,2023-05-05T18:01:05Z
WZXfHND5Yec,The Best Met Gala Looks of All Time,99473,2023-05-05T18:01:03Z
4-nib6sGXVM,Jenna Ortega Tries on Her Met Gala Dress,531826,2023-05-05T17:01:06Z
5F4chBIZ1S4,"Alia Bhatt: ""From Mumbai to the Met""",7872172,2023-05-05T16:03:58Z
pjZEGvre900,Emma Chamberlain Inside the 2023 Met Gala,95198,2023-05-05T16:01:10Z
I2RFK3vp1lc,Jeremy Pope Makes a Statement at the Met,378199,2023-05-05T15:00:21Z
dyNuSEsK68Q,Margot Robbie Inside the 2023 Met Gala,152784,2023-05-05T14:45:08Z
YkLA5JQ_ZWI,Blackpink's Jennie Inside the 2023 Met Gala,253103,2023-05-05T14:15:15Z
bxr87lUtiLg,Inside Alia Bhatt's First Met Gala | Vogue,7981778,2023-05-04T23:53:35Z
D-Z8Fs1dcvw,Brittney & Cherelle Griner Get Ready for the Met Gala | Vogue,128947,2023-05-04T22:01:03Z
hSIDVZWQYpQ,"Kylie, Kendall and Kim Inside the 2023 Met Gala",2402557,2023-05-04T22:01:01Z
3waix-YXqT0,Cardi B Inside the 2023 Met Gala,215746,2023-05-04T20:00:01Z
kwHxQ4Uuq1k,Gigi Hadid Inside the 2023 Met Gala,257485,2023-05-04T18:34:17Z
kPS_DjyWk3A,Behind Cara Delevingne's Met Gala Glam | Vogue,745083,2023-05-04T18:00:04Z
see8-tsT2as,Bad Bunny Gets Ready for the Met Gala | Vogue,763159,2023-05-04T16:00:04Z
JjtBDe30bvc,Emma Chamberlain Has Found Her Calling,2021727,2023-05-04T15:28:51Z
4FVbWTCO8Kc,Billie Eilish Gets Ready for the Met Gala | Vogue,2374461,2023-05-03T22:30:01Z
YHk6Rf8awK8,Formula One Driver Daniel Ricciardo Gets Ready for the Met Gala | Vogue,380271,2023-05-03T22:08:35Z
iAx4d_7N4-A,Lila Moss Gets Ready for the Met Gala (ft. Kate Moss) | Vogue,555022,2023-05-03T21:00:03Z
SCXrdp94lmo,Michelle Yeoh Gets Ready for the Met Gala | Vogue,361605,2023-05-03T20:30:01Z
qPEExq_AdaM,The Making of Jenna Ortega's Met Gala Dress | Vogue,1392655,2023-05-03T18:30:04Z
E4JG_L8nb0c,Diddy & Yung Miami Get Ready for the Met Gala | Vogue,381576,2023-05-03T17:45:02Z
Pux51QmlDv8,Dua Lipa Gets Ready for the Met Gala | Vogue,2288084,2023-05-03T15:30:02Z
yq0X_F9HS10,Ice Spice Gets Ready for a Met Gala After-Party | Vogue,4167595,2023-05-03T15:00:02Z
Sm3OwRlpAGA,Doja Cat Gets Ready for the Met Gala | Vogue,2055165,2023-05-03T14:00:08Z
Y6zrWIDcLhk,Celeb Couples Shine 💎 on the Met Gala Red Carpet,240706,2023-05-02T21:32:59Z
Vekre0_EQuI,Blackpink’s Jennie Gets Ready for the Met Gala | Vogue,5865716,2023-05-02T21:04:03Z
oVVnfNcq9ZM,Cardi B Gets Ready for the Met Gala | Vogue,1203434,2023-05-02T19:04:51Z
06KOZ4Q9BAM,Jared Leto Arrives at the Met Gala as Karl Lagerfeld's Cat,1162840,2023-05-02T17:27:17Z
zkMc4J0Vzuo,The Crowd Cheers for Rihanna at the Met Gala,238678,2023-05-02T17:16:04Z
rVEf4Hvxg1g,Priyanka Chopra & Nick Jonas Stun on the Met Gala Carpet,412460,2023-05-02T17:15:34Z
yrgsXh2WXsI,Jenna Ortega's Wednesday-Worthy Met Gala Look,549518,2023-05-02T17:05:40Z
iNxJ6S9GFSM,"Kim Kardashian Arrives in 50,000 Pearls",163003,2023-05-02T17:04:23Z
G7ckWmNH2Rc,🖤💗 Blackpink’s Jennie Kim Arrives at the Met Gala 📷,621584,2023-05-02T16:47:06Z
9X3FxWwqe-8,Doja Cat Channels Choupette at the Met Gala,613074,2023-05-02T16:38:08Z
ZrFY-1wz-NU,"""Being Barefoot is Chic"" Devon Aoki Recalls a Karl Lagerfeld Moment | Met Gala 2023",310358,2023-05-02T16:00:04Z
mPO5aZGLyQI,Lil Nas X is Pure Silver at the Met Gala,313852,2023-05-02T15:57:34Z
y_Im9cGF6Do,"Sarah Jessica Parker: ""How I Interpret Met Gala Themes"" 👗  #MetGala #TheMet",61027,2023-05-02T13:00:02Z
Ahlk19RCc7Q,Gigi Hadid Thinks the Drive to the Met Gala is the Scariest Part | Met Gala 2023 | Vogue,1100763,2023-05-02T05:46:38Z
Y98UcZzs_-U,Emily Blunt & Michael Kors Arrive at the Met Gala | Met Gala 2023 With Emma Chamberlain | Vogue,337245,2023-05-02T05:45:44Z
bm5G9ijts-Q,Billie Eilish Explores Layers and Textures at Met Gala | Met Gala 2023 With Emma Chamberlain | Vogue,1901454,2023-05-02T05:38:34Z
xuc0mKG3oRo,Elle Fanning’s Spring Fairy Met Look | Met Gala 2023 With Emma Chamberlain | Vogue,308928,2023-05-02T05:36:24Z
FN9KYZd5OaA,"Vanessa Hudgens is Shocked By All the Met Gala ""Iconic-ness"" | Met Gala 2023 With Emma Chamberlain",574875,2023-05-02T05:35:27Z
sug_pLv86B8,Simu Liu Embodies Karl Lagerfeld in Versace | Met Gala 2023 With Emma Chamberlain | Vogue,229022,2023-05-02T05:18:26Z
ujkx2RO0gJk,Halle Bailey Channels Ariel on the Met Red Carpet | Met Gala 2023 With Emma Chamberlain | Vogue,339028,2023-05-02T05:10:58Z
