VideoID,VideoName,Views,UploadDate
KG_qtsGCaq0,Isabel Marant Ready to Wear Fall 2013 Vogue Fashion Week Runway Show,6473,2013-03-01T18:19:15Z
UcdF5mEnHww,Roland Mouret Ready to Wear Fall 2013 Vogue Fashion Week Runway Show,950,2013-03-01T15:36:15Z
tr0UYFMxeyI,Chalayan Ready to Wear Fall 2013 Vogue Fashion Week Runway Show,54809,2013-03-01T13:10:10Z
ZsPewWp1cpU,Black and White Striped Pants by Genetic  - Jeanius: Jorden Bickham - Vogue,4794,2013-03-01T02:13:13Z
VaCSi2L-OoE,Lanvin Ready to Wear Fall 2013 Vogue Fashion Week Runway Show,6122,2013-03-01T01:43:57Z
gLZkh4x8cPo,Nina Ricci Ready to Wear 2013 Vogue Fashion Week Runway Show,2996,2013-02-28T23:00:30Z
FQMTLMKN-BM,Lanvin's Alber Elbaz - Vogue Voices,138235,2013-02-28T22:18:27Z
UMVvBYHeZhU,Rick Owens Ready to Wear Fall 2013 Vogue Fashion Week Runway Show,3618,2013-02-28T20:24:40Z
f6sacrO3XzQ,Balenciaga Ready to Wear Fall 2013 Vogue Fashion Week Runway Show,13608,2013-02-28T19:29:28Z
4q2bPiMUfTg,Balmain Ready to Wear 2013 Vogue Fashion Week Runway Show,7959,2013-02-28T18:43:26Z
HKp0ZVFL-cM,"Vogue Voices: Alber Elbaz, Part Two",1925,2013-02-28T17:52:43Z
kM6xwCPpv6U,Ann Demeulemeester Ready to Wear Fall 2013 Vogue Fashion Week Runway Show,5647,2013-02-28T14:45:38Z
swMVSps2P6c,Carven Ready to Wear Fall 2013 Vogue Fashion Week Runway Show,2450,2013-02-28T13:03:41Z
l-PQ0a57lio,Rochas Ready to Wear Fall 2013 Vogue Fashion Week Runway Show,1335,2013-02-27T19:47:21Z
TwHDQ_w5aXQ,Dries Van Noten Ready to Wear Fall 2013 Vogue Fashion Week Runway Show,8003,2013-02-27T17:48:21Z
DwzBBGgI5Yo,Anthony Vaccarello Ready to Wear Fall 2013 Vogue Fashion Week Runway Show,2224,2013-02-26T19:55:10Z
5Zdyod19BJE,Mondays with André: L'Wren Scott,21646,2013-02-25T17:06:47Z
j94nI79kw8o,Giorgio Armani Ready to Wear Fall 2013 Vogue Fashion Week Runway Show,1286,2013-02-25T14:38:05Z
JZCb57F3iJU,Salvatore Ferragamo Ready to Wear Fall 2013 Vogue Fashion Week Runway Show,746,2013-02-25T00:19:01Z
L38HbE0l-Uo,Missoni Ready to Wear Fall 2013 Vogue Fashion Week Runway Show,698,2013-02-24T18:43:56Z
xMNzmOBATwk,Dolce & Gabbana Ready to Wear Fall 2013 Vogue Fashion Week Runway Show,4247,2013-02-24T15:55:10Z
gzX6Mo526Fw,Marni Ready to Wear Fall 2013 Vogue Fashion Week Runway Show,2099,2013-02-24T11:36:57Z
xPnZRyz-zQU,Vogue Voices: Alber Elbaz,1717,2013-02-24T00:44:55Z
69ie1sKOebM,Emilio Pucci Ready to Wear Fall 2013 Vogue Fashion Week Runway Show,1732,2013-02-23T21:25:18Z
Q_ztcAVtvyI,Aquilano.Rimondi Ready to Wear Fall 2013 Vogue Fashion Week Runway Show,550,2013-02-23T19:23:13Z
pQ0KymH7q4M,Roberto Cavalli Ready to Wear Fall 2013 Vogue Fashion Week Runway Show,1129,2013-02-23T15:08:49Z
oUm2imhfH24,Bottega Veneta Ready to Wear Fall 2013 Vogue Fashion Week Runway Show,3598,2013-02-23T12:12:57Z
mGnso8iSKiw,Versace Ready to Wear Fall 2013 Vogue Fashion Week Runway Show,4867,2013-02-22T21:49:30Z
rd7vQA8Yhr0,Blumarine Ready to Wear Fall 2013 Vogue Fashion Week Runway Show,1879,2013-02-22T19:02:00Z
aAlaIr5xo4c,Etro Ready to Wear Fall 2013 Vogue Fashion Week Runway Show,1271,2013-02-22T13:53:31Z
5r9zQ3lJaF8,Moschino Ready to Wear Fall 2013 Vogue Fashion Week Runway Show,2525,2013-02-22T11:12:02Z
jk4xiJGP60Q,Paige Denim Jean - Jeanius: Valerie Boster - Vogue,2782,2013-02-21T21:34:08Z
EZKJT6QFVnc,Prada Ready to Wear Fall 2013 Vogue Fashion Week Runway Show,9288,2013-02-21T20:34:11Z
_1IsR5fRz24,This Is London: A Look Back at Fashion Week Fall 2013,1607,2013-02-21T19:18:24Z
xJqCmEE0Kww,Fendi Ready to Wear Fall 2013 Vogue Fashion Week Runway Show,2323,2013-02-21T15:35:19Z
rHcM-Ei4nqI,MaxMara Ready to Wear Fall 2013 Vogue Fashion Week Runway Show,2848,2013-02-21T12:05:46Z
LQNxUfHHD8Y,No. 21 Ready to Wear Fall 2013 Vogue Fashion Week Runway Show,898,2013-02-20T22:36:03Z
VYKDTK-vKGM,Alberta Ferretti Ready to Wear Fall 2013 Vogue Fashion Week Runway Show,763,2013-02-20T19:07:08Z
6GYke6_qRBI,Anya Hindmarch Ready to Wear Fall 2013 Vogue Fashion Week Runway Show,658,2013-02-20T18:44:07Z
YrygCdJ2BBI,Gucci Ready to Wear Fall 2013 Vogue Fashion Week Runway Show,3833,2013-02-20T17:51:44Z
Y6yawjNxo1U,Meadham Kirchhoff Ready to Wear Fall 2013 Vogue Fashion Week Runway Show,1223,2013-02-19T14:50:26Z
oH3cCrprj9A,Roksanda Ilincic Ready to Wear Fall 2013 Vogue Fashion Week Runway Show,885,2013-02-19T13:34:02Z
PKaCSljLUCg,Simone Rocha Ready to Wear Fall 2013 Vogue Fashion Week Runway Show,1591,2013-02-19T12:49:30Z
sHY4J9P1ViM,J.W. Anderson Women Ready to Wear Fall 2013 Vogue Fashion Week Runway Show,1644,2013-02-18T21:53:41Z
mQQ4tAcIRyM,Burberry Prorsum Ready to Wear Fall 2013 Vogue Fashion Week Runway Show,2765,2013-02-18T20:13:20Z
uFzMc3hgfnc,Christopher Kane Ready to Wear Fall 2012 Vogue Fashion Week Runway Show,2527,2013-02-18T18:24:05Z
8UPnfSmfbEo,Erdem Ready to Wear Fall 2013 Vogue Fashion Week Runway Show,1074,2013-02-18T18:14:28Z
Z3O0GRl67DU,Mondays with André: Marc Jacobs on Pajamas,13515,2013-02-18T16:46:02Z
JUtVkm_8tIM,Louise Gray Ready to Wear Fall 2013 Vogue Fashion Week Runway Show,512,2013-02-18T15:25:20Z
Vg7JJTlztjY,Peter Pilotto Ready to Wear Fall 2013 Vogue Fashion Week Runway Show,1610,2013-02-18T15:01:51Z
g5mwErHt4oQ,Antonio Berardi Ready to Wear Fall 2013 Vogue Fashion Week Runway Show,1996,2013-02-18T13:06:12Z
lU-NXsBld2w,Michael van der Ham Ready to Wear Fall 2013 Vogue Fashion Week Runway Show,559,2013-02-18T12:45:58Z
gz95g6mxdYk,Richard Nicoll Ready to Wear Fall 2013 Vogue Fashion Week Runway Show,699,2013-02-18T02:19:48Z
Pdi_BCSfyHM,Richard Nicoll_V_US,107,2013-02-18T01:55:18Z
9HbnagSQBgQ,Paul Smith Ready to Wear Fall 2013 Vogue Fashion Week Runway Show,826,2013-02-18T01:20:27Z
NpVC1_Lgw8Y,Marios Schwab Ready to Wear Fall 2013 Vogue Fashion Week Runway Show,1181,2013-02-18T00:35:12Z
rHIbSaL9V8Y,Matthew Williamson Ready to Wear Fall 2013 Vogue Fashion Week Runway Show,1301,2013-02-17T23:40:16Z
JqIgoVsOsCk,Jonathan Saunders Ready to Wear Fall 2013 Vogue Fashion Week Runway Show,640,2013-02-17T23:20:49Z
CbNQ8vYaDSA,Mary Katrantzou Ready to Wear Fall 2013 Vogue Fashion Week Runway Show,2883,2013-02-17T19:32:47Z
vst4Q7bxi9U,Topshop Unique Ready to Wear Fall 2013 Vogue Fashion Week Runway Show,2188,2013-02-17T18:10:00Z
rUYS7lr96G0,L'Wren Scott Ready to Wear Fall 2013 Vogue Fashion Week Runway Show,6383,2013-02-17T15:37:18Z
c0Nqvd3y1Js,Mulberry Ready to Wear Fall 2013 Vogue Fashion Week Runway Show,926,2013-02-17T14:50:13Z
XywuDGokHdc,Preen Ready to Wear Fall 2013 Vogue Fashion Week Runway Show,1208,2013-02-17T11:59:55Z
UiyS4lkoxB4,Holly Fulton Ready to Wear Fall 2013 Vogue Fashion Week Runway Show,354,2013-02-17T11:59:45Z
Fc8w80oIarY,David Koma Ready to Wear Fall 2013 Vogue Fashion Week Runway Show,1125,2013-02-16T22:37:31Z
qouIeyGQugU,This Is New York: A Look Back at Fashion Week Fall 2013,1692,2013-02-16T20:48:44Z
pjvOHJAwjxc,Christopher Raeburn Ready to Wear Fall 2013 Vogue Fashion Week Runway Show,240,2013-02-16T12:47:25Z
yN-eWbAI-50,Marc Jacobs Ready to Wear Fall 2013 Vogue Fashion Week Runway Show,3014,2013-02-15T19:52:25Z
2itwHawkuLw,J Brand Flare Jean - Jeanius: Chloe Malle - Vogue,4811,2013-02-15T16:55:22Z
jm_Z8WymNcg,Calvin Klein Ready to Wear Fall 2013 Vogue Fashion Week Runway Show,1836,2013-02-14T22:16:13Z
nAWyQpMN-2E,Ralph Lauren Ready to Wear Fall 2013 Vogue Fashion Week Runway Show,5831,2013-02-14T20:48:50Z
27gvWSZgxiY,"Love Songs: ""Cool as a Fire"" by Chairlift",27025,2013-02-14T16:17:15Z
RWps_hvcsOc,Proenza Schouler Ready to Wear Fall 2013 Vogue Fashion Week Runway Show,2245,2013-02-14T04:48:44Z
u8KLX2E-5qU,Marchesa Ready to Wear Fall 2013 Vogue Fashion Week Runway Show,4301,2013-02-14T01:42:47Z
kmXzMIHt1LU,Reed Krakoff Ready to Wear Fall 2013 Vogue Fashion Week Runway Show,385,2013-02-14T00:10:55Z
i66C7YPzYsA,J. Mendel Ready to Wear Fall 2013 Vogue Fashion Week Runway Show,447,2013-02-13T22:49:49Z
oy28gsd5ZIU,Peter Som Ready to Wear Fall 2013 Vogue Fashion Week Runway Show,594,2013-02-13T18:24:46Z
fKFaCBd0lnI,Michael Kors Ready to Wear Fall 2013 Vogue Fashion Week Runway Show,2990,2013-02-13T18:01:45Z
gXh33EtPjpc,Love Songs: Jonny Pierce,64424,2013-02-13T16:10:44Z
rHMdkJhrgn0,Narciso Rodriguez Ready to Wear Fall 2013 Vogue Fashion Week Runway Show,1755,2013-02-13T05:34:44Z
wLG9sOmoJvo,Oscar De La Renta Ready to Wear Fall 2013 Vogue Fashion Week Runway Show,5974,2013-02-13T04:10:49Z
gXgQqk8LoDs,Rodarte Ready to Wear Fall 2013 Vogue Fashion Week Runway Show,2944,2013-02-13T02:23:28Z
oBNQJRgVjws,Sophie Theallet Ready to Wear Fall 2013 Vogue Fashion Week Runway Show,401,2013-02-13T00:44:19Z
uYJHf3tU828,Vera Wang Ready to Wear Fall 2013 Vogue Fashion Week Runway Show,2668,2013-02-12T21:40:39Z
Y249_DqemrM,Love Songs: Liza Thorn,6910,2013-02-12T18:46:18Z
VL43212PaJA,Tory Burch Ready to Wear Fall 2013 Vogue Fashion Week Runway Show,1176,2013-02-12T17:19:35Z
agmNz2AIv00,Marc by Marc Jacobs Ready to Wear Fall 2013 Vogue Fashion Week Runway Show,3282,2013-02-12T03:20:39Z
mQ5OIMT5cbU,Zero+ Maria Cornejo Ready to Wear Fall 2013 Vogue Fashion Week Runway Show,670,2013-02-12T02:28:09Z
I4og5cXfwf0,3.1 Phillip Lim Ready to Wear Fall 2013 Vogue Fashion Week Runway Show,6555,2013-02-11T23:23:54Z
1Cdz9babTfA,Donna Karan Ready to Wear Fall 2013 Vogue Fashion Week Runway Show,1708,2013-02-11T22:31:37Z
YJudNZoDoMA,Ohne Titel Ready to Wear Fall 2013 Vogue Fashion Week Runway Show,392,2013-02-11T21:14:05Z
ntICV1zDIoo,Theyskens' Theory Ready to Wear Fall 2013 Vogue Fashion Week Runway Show,1772,2013-02-11T20:44:27Z
toQXPFzFU38,Love Songs: Bat for Lashes,82720,2013-02-11T19:35:52Z
xepiWGDgeWM,Belstaff Ready to Wear Fall 2013 Vogue Fashion Week Runway Show,1304,2013-02-11T18:48:49Z
ZI14oCMlcuo,Carolina Herrera Ready to Wear Fall 2013 Vogue Fashion Week Runway Show,2594,2013-02-11T17:53:59Z
xicV63UzI3E,Mondays with André: Ugly Shoes,9773,2013-02-11T05:22:31Z
gTDTyn-awn8,Tommy Hilfiger Ready to Wear Fall 2013 Vogue Fashion Week Runway Show,2938,2013-02-11T04:32:52Z
Ac3_rtWYHeo,Zac Posen Ready to Wear Fall 2013 Vogue Fashion Week Runway Show,9238,2013-02-11T02:15:31Z
bkACAICLeEs,Diane von Furstenberg Ready to Wear Fall 2013 Vogue Fashion Week Runway Show,1420,2013-02-11T00:00:40Z
b08pmMxRVvs,Thakoon Ready to Wear Fall 2013 Vogue Fashion Week Runway Show,1192,2013-02-10T23:33:39Z
NdGov7HUKT8,DKNY Ready to Wear Fall 2013 Vogue Fashion Week Runway Show,1062,2013-02-10T20:51:20Z
qf7BoSvMfNI,Derek Lam Ready to Wear Fall 2013 Vogue Fashion Week Runway Show,1187,2013-02-10T19:44:07Z
BKhjf3Hfhzs,Victoria Beckham Ready to Wear Fall 2013 Vogue Fashion Week Runway Show,24228,2013-02-10T19:12:18Z
axq1Z2TjBMU,Altuzarra Ready to Wear Fall 2013 Vogue Fashion Week Runway Show,1896,2013-02-10T05:56:56Z
piLRMjkJ2uM,Prabal Gurung Ready to Wear Fall 2013 Vogue Fashion Week Runway Show,971,2013-02-10T02:39:34Z
Spzv0_L4Wjk,Band of Outsiders Ready to Wear Fall 2013 Vogue Fashion Week Runway Show,1090,2013-02-10T02:11:16Z
lQEh0QZHN4c,Alexander Wang Ready to Wear Fall 2013 Vogue Fashion Week Runway Show,3696,2013-02-10T01:58:04Z
bCU62sW7Wgk,Love Songs: Widowspeak,10754,2013-02-09T19:34:35Z
bg8iY-2jNNo,Lacoste Ready to Wear Fall 2013 Vogue Fashion Week Runway Show,633,2013-02-09T17:17:18Z
pCYWbw0Mivk,Billy Reid,1138,2013-02-09T07:35:01Z
i12AboVbN6Y,Suno Ready to Wear Fall 2013 Vogue Fashion Week Runway Show,532,2013-02-09T04:52:49Z
xtN5lrBw_ow,Helmut Lang Ready to Wear Fall 2013 Vogue Fashion Week Runway Show,2441,2013-02-09T02:32:36Z
0IHjLHrYny0,Rag & Bone Ready to Wear Fall 2013 Vogue Fashion Week Runway Show,1111,2013-02-09T01:56:23Z
aT8dd9yzFgQ,Classic 1950's Levi Jean - Jeanius: Chioma Nnadi - Vogue,4086,2013-02-09T01:09:37Z
aGSRMKiTkkI,Jason Wu Ready to Wear Fall 2013 Vogue Fashion Week Runway Show,1691,2013-02-08T22:32:45Z
kuHOZC_hki4,Creatures of the Wind Ready to Wear Fall 2013 Vogue Fashion Week Runway Show,1219,2013-02-07T19:37:03Z
riFH9upsEoU,BCBG Max Azria Ready to Wear Fall 2013 Vogue Fashion Week Runway Show,2260,2013-02-07T18:10:34Z
PQFZYm25vdg,Mondays with André: Oxford Union,7242,2013-02-04T15:57:05Z
r5VTYKU9Mfs,The Pefect Wax Jean by Habitual - Jeanius: Sylvana Ward Durrett - Vogue,6182,2013-02-01T14:58:50Z
4ijvfYOsuFM,Alex White Video,2060,2013-01-28T22:34:22Z
PCY_8Rs3jCM,Mondays with André: Max Chow,13034,2013-01-28T15:01:27Z
Fvq_wzxnVCA,Rag & Bone Bell Bottom Jeans - Jeanius: Emma Morrison - Vogue,11914,2013-01-25T15:56:47Z
bPGXUhGkbvQ,Mondays with André: Michelle Obama,14615,2013-01-21T02:22:35Z
T28jWBa0bHg,Theyskens' Theory Powser Vintage Jean - Jeanius: Esther Adams - Vogue,3661,2013-01-18T16:08:05Z
G3yjxhi7Wzc,D.S. & Durga,12085,2013-01-17T16:55:52Z
CYVAM7YxZyI,Mondays with André: Meeting Quvenzhané Wallis,44903,2013-01-14T14:36:57Z
cBh1k1eJhFs,Stella McCartney Skinny White Jeans - Jeanius: Kelly Connor - Vogue,6850,2013-01-11T16:42:52Z
Vw0F5y0rVKg,This is Not a Suit (2010),2265,2013-01-04T22:28:06Z
IRwoVruP1jc,Get Swept Away with Carolyn Murphy and Matthias Schoenaerts in Tuscany,31976,2012-11-26T16:13:10Z
083rYCPxHt4,And the 2012 CFDA/Vogue Fashion Fund Winner Is . . .,31045,2012-11-15T03:08:50Z
ptk9GqEtma0,L.A. Fashion Show at Chateau Marmont - CFDA/Vogue Fashion Fund - Vogue,23736,2012-11-12T15:48:12Z
a0olOJU_3uI,"The Fashion Fund: Episode 5, Season 2",25180,2012-11-05T14:35:55Z
I2obMcXqGCk,New York Fashion Week with the Finalists - CFDA/Vogue Fashion Fund - Vogue,4422,2012-10-24T13:39:31Z
xz58F4bKNW8,Andre Leon Talley on the Grammy's Red Carpet,3415,2012-10-24T13:31:18Z
i6NyjYdBxKA,Site and Storefront Visits - CFDA/Vogue Fashion Fund 2012 - Vogue,39874,2012-10-24T13:31:14Z
4B5X_Mm-2-w,CK_JEANS_MASTERBRAND_0060,637,2012-10-24T13:26:13Z
Zxk8poHOJR4,Fashion's Night Out 2012: Justin Bieber & Taylor Swift,10847,2012-10-24T13:24:47Z
Q7f4cN1pLt0,Nina Ricci Ready to Wear 2012 Vogue Fashion Week Runway Show,1624,2012-10-24T13:19:22Z
Ffb24LM8RP8,Kate Upton - Behind the Scenes of Her Vogue Shoot,42975,2012-10-24T13:16:19Z
HqAN1i3nLvw,Alexander McQueen Ready to Wear 2012 Vogue Fashion Week Runway Show,1186,2012-10-24T13:15:27Z
M80YEmVhCOM,Calvin Klein  Ready to Wear 2012 Vogue Fashion Week Runway Show,297,2012-10-24T13:13:54Z
K4ZB95KBWDQ,The Tiffany & Co. Design Challenge - CFDA/Vogue Fashion Fund 2012 - Vogue,31400,2012-10-16T16:43:40Z
-IN_sUeBbKw,Anthony Vaccarello Ready to Wear Fall 2012 Vogue Fashion Week Runway Show,989,2012-10-15T21:24:12Z
ydtyKi99cAg,Christopher Kane Ready to Wear Spring 2013 Vogue Fashion Week Runway Show,3178,2012-10-15T21:19:41Z
N41dkd0Oue8,Marchesa Ready to Wear Fall 2012 Vogue Fashion Week Runway Show,1028,2012-10-15T21:13:04Z
kiFCcYzE5hk,Proenza Schouler Ready to Wear Fall 2012 Vogue Fashion Week Runway Show,396,2012-10-15T21:10:24Z
0ChhAv0wVbo,Rick Owens Ready to Wear Spring 2013 Vogue Fashion Week Runway Show,672,2012-10-09T15:27:43Z
Sh2exRxK-hk,The Finalist Report to Panel - CFDA/Vogue Fashion Fund - Vogue,44433,2012-10-09T14:16:37Z
FUZaWIppnpU,This is Paris: A Look Back at Fashion Week Spring 2013,3680,2012-10-05T20:43:38Z
9x1RaAmFPws,Miu Miu Ready to Wear Spring 2013 Vogue Fashion Week Runway Show,7765,2012-10-03T17:12:16Z
ITEqWZsMPso,Louis Vuitton Ready to Wear Spring 2013 Vogue Fashion Week Runway Show,4812,2012-10-03T11:57:04Z
scotsLbEgOY,Moncler Gamme Rouge Ready to Wear Spring 2013 Vogue Fashion Week Runway Show,3991,2012-10-02T23:49:01Z
ivfYvZQpjeg,Alexander McQueen Ready to Wear Spring 2013 Vogue Fashion Week Runway Show,17704,2012-10-02T22:38:05Z
448j_86n9Dc,Valentino Ready to Wear Spring 2013 Vogue Fashion Week Runway Show,6678,2012-10-02T16:10:57Z
Z2ffa1fDdW0,Chanel Ready to Wear Spring 2013 Vogue Fashion Week Runway Show,25412,2012-10-02T14:43:48Z
DQaHG9Gm8_A,Selecting the Finalists - CFDA/Vogue Fashion Fund - Vogue,89366,2012-10-02T12:27:22Z
mBIQodmkfTw,Saint Laurent Ready to Wear Spring 2013 Vogue Fashion Week Runway Show,53029,2012-10-01T21:50:01Z
B-R5P94OBi8,Pedro Lourenço Ready to Wear Spring 2013 Vogue Fashion Week Runway Show,654,2012-10-01T18:08:59Z
8bdJPe7tcKw,Chloé Ready to Wear Spring 2013 Vogue Fashion Week Runway Show,9579,2012-10-01T17:49:49Z
6ixOgCZd5v8,Giambattista Valli Ready to Wear Spring 2013 Vogue Fashion Week Runway Show,6234,2012-10-01T15:51:21Z
5DbqT2vO1SE,Sacai Ready to Wear Spring 2013 Vogue Fashion Week Runway Show,2756,2012-10-01T15:16:30Z
q_x1_vHUM3k,Stella McCartney Ready to Wear Spring 2013 Vogue Fashion Week Runway Show,2722,2012-10-01T11:43:47Z
l8wvcPGQFSo,Givenchy Ready to Wear Spring 2013 Vogue Fashion Week Runway Show,15579,2012-09-30T21:44:53Z
OL2nV5pJwAo,Akris Ready to Wear Spring 2013 Vogue Fashion Week Runway Show,2829,2012-09-30T20:16:36Z
34v3BkTen6w,John Galliano Ready to Wear Spring 2013 Vogue Fashion Week Runway Show,2718,2012-09-30T18:36:48Z
FnCISDgkdlY,Kenzo Ready to Wear Spring 2013 Vogue Fashion Week Runway Show,1968,2012-09-30T13:52:57Z
u2tEEI9cc_s,Loewe Ready to Wear Spring 2013 Vogue Fashion Week Runway Show,1944,2012-09-30T10:40:52Z
5WML0NXVvWc,Jean Paul Gaultier Ready to Wear Spring 2013 Vogue Fashion Week Runway Show,26944,2012-09-30T02:34:38Z
hVQ68ov9kzU,Haider Ackermann Ready to Wear 2013 Vogue Fashion Week Runway Show,7162,2012-09-29T11:57:05Z
cn0jL8QpnOw,Maison Martin Margiela Ready to Wear Spring 2013 Vogue Fashion Week Runway Show,2462,2012-09-28T22:53:56Z
Yn1PYcakmJU,Roland Mouret Ready to Wear Spring 2013 Vogue Fashion Week Runway Show,1093,2012-09-28T22:07:26Z
qIKbgQCHpKE,Chalayan Ready to Wear Spring 2013 Vogue Fashion Week Runway Show,3566,2012-09-28T22:04:33Z
LESGkKQGAdU,Isabel Marant Ready to Wear 2013 Vogue Fashion Week Runway Show,12258,2012-09-28T21:52:45Z
tK2QIMvr3tA,Christian Dior Ready to Wear 2013 Vogue Fashion Week Runway Show,4030,2012-09-28T21:50:26Z
qmoNzJnuhdg,Lanvin Ready to Wear Spring 2013 Vogue Fashion Week Runway Show,13513,2012-09-28T01:20:20Z
9qDBg9JPGfg,Nina Ricci Ready to Wear Spring 2012 Vogue Fashion Week Runway Show,5212,2012-09-27T22:58:11Z
0P9TLo63ns0,Ann Demeulemeester Ready to Wear Spring 2013 Vogue Fashion Week Runway Show,5248,2012-09-27T19:35:21Z
3xiHX08faU8,Balmain Ready to Wear Spring 2013 Vogue Fashion Week Runway Show,17393,2012-09-27T18:12:02Z
dVtt4qx6drM,Balenciaga Ready to Wear 2013 Vogue Fashion Week Runway Show,7646,2012-09-27T12:56:23Z
Lll4Dai8P0M,Carven Ready to Wear 2013 Vogue Fashion Week Runway Show,1780,2012-09-27T12:17:51Z
7LNVz68IcsE,Dries Van Noten Ready to Wear Spring 2013 Vogue Fashion Week Runway Show,7866,2012-09-26T20:57:47Z
r6v6p8I3fjg,Rochas Ready to Wear Spring 2013 Vogue Fashion Week Runway Show,1417,2012-09-26T18:20:50Z
kHaQW09OnkI,Jil Sander Ready to Wear Spring 2013 Vogue Fashion Week Runway Show,1032,2012-09-25T20:43:24Z
CcnbIZDQ5Kk,2012 CFDA/Vogue Fashion Fund teaser,5288,2012-09-25T19:25:54Z
r8Wv0frOqW0,Anthony Vaccarello Ready to Wear Spring 2013 Vogue Fashion Week Runway Show,6871,2012-09-25T19:17:30Z
o1QUWsSAddU,This is Milan: A Look Back at Fashion Week Spring 2013,1197,2012-09-25T18:47:07Z
Vb0YVUKbd8A,Roberto Cavalli Ready to Wear 2013 Vogue Fashion Week Runway Show,1155,2012-09-24T15:21:01Z
01CukRTaNyY,Giorgio Armani Ready to Wear 2013 Vogue Fashion Week Runway Show,1730,2012-09-23T21:12:22Z
bVmJUsgrVIs,Salvatore Ferragamo Ready to Wear 2013 Vogue Fashion Week Runway Show,1828,2012-09-23T19:07:43Z
1fQIEUdQU4I,Missoni Ready to Wear 2013 Vogue Fashion Week Runway Show,1614,2012-09-23T16:20:41Z
VrNTssusWD4,Dolce & Gabbana Ready to Wear Spring 2013 Vogue Fashion Week Runway Show,9900,2012-09-23T14:50:03Z
6EXUf6FGRdU,Marni Spring 2013,1356,2012-09-23T10:41:32Z
KeX4Er4szJc,Versus Ready to Wear 2013 Vogue Fashion Week Runway Show,600,2012-09-22T20:26:04Z
HhcANR1uydQ,Emilio Pucci Ready to Wear 2013 Vogue Fashion Week Runway Show,2821,2012-09-22T19:26:14Z
kQ3WGaz03vA,Aquilano.Rimondi Ready to Wear 2013 Vogue Fashion Week Runway Show,484,2012-09-22T18:42:57Z
o2P9IiArPiE,Fendi Ready to Wear 2013 Vogue Fashion Week Runway Show,1881,2012-09-22T13:17:50Z
FyhjBwrz7qM,Bottega Veneta Ready to Wear 2013 Vogue Fashion Week Runway Show,7391,2012-09-22T12:29:54Z
W4Jlznze8Cs,Versace Ready to Wear Spring 2013 Vogue Fashion Week Runway Show,5099,2012-09-21T20:05:57Z
k-Coz9sqWZo,Blumarine Ready to Wear Spring 2013 Vogue Fashion Week Runway Show,1379,2012-09-21T18:38:56Z
O_MWZhKH9ME,Etro Ready to Wear Spring 2013 Vogue Fashion Week Runway Show,1532,2012-09-21T14:38:22Z
qlHQeODIPFE,Moschino Ready to Wear Spring 2013 Vogue Fashion Week Runway Show,1939,2012-09-21T11:53:17Z
hEc_nhAY5fI,Prada Ready to Wear 2013 Vogue Fashion Week Runway Show,2299,2012-09-20T21:32:35Z
c-7FF67u0Xc,MaxMara Ready to Wear 2013 Vogue Fashion Week Runway Show,998,2012-09-20T13:01:38Z
I54k_v3CCME,No. 21 Ready to Wear Spring 2013 Vogue Fashion Week Runway Show,535,2012-09-19T21:12:46Z
q6A_DWbHInw,This is London: A Look Back at Fashion Week Spring 2013,1427,2012-09-19T20:18:14Z
uZNiSxiaAYQ,Alberta Ferretti Ready to Wear Spring 2013 Vogue Fashion Week Runway Show,1108,2012-09-19T19:27:27Z
WoCwE6v7Nog,Gucci Ready to Wear Spring 2013 Vogue Fashion Week Runway Show,11262,2012-09-19T16:46:19Z
vvTk8_6Jfpw,Roksanda Ilincic Ready to Wear Spring 2013 Vogue Fashion Week Runway Show,2679,2012-09-18T21:18:59Z
EKjvLSbmWKg,Mulberry Ready to Wear Spring 2013 Vogue Fashion Week Runway Show,856,2012-09-18T20:56:45Z
aYm-wI18Fqs,Meadham Kirchhoff Ready to Wear Spring 2013 Vogue Fashion Week Runway Show,2676,2012-09-18T20:56:26Z
Q7HbJnFMzDU,Erdem Ready to Wear Spring 2013 Vogue Fashion Week Runway Show,1330,2012-09-17T21:49:41Z
UgeGJT6vBUA,J.W. Anderson Ready to Wear Spring 2013 Vogue Fashion Week Runway Show,981,2012-09-17T21:46:16Z
Dgb2Iwu-8Ds,Richard Nicoll Ready to Wear Spring 2013 Vogue Fashion Week Runway Show,560,2012-09-17T21:30:59Z
OTfBtiiWuC8,Louise Gray Ready to Wear Spring 2013 Vogue Fashion Week Runway Show,322,2012-09-17T20:03:17Z
FN6A9OF_CE8,Burberry Prorsum Ready to Wear Spring 2013 Vogue Fashion Week Runway Show,1977,2012-09-17T19:14:30Z
lvYsBo2Px2c,Peter Pilotto Ready to Wear Spring 2013 Vogue Fashion Week Runway Show,722,2012-09-17T17:44:22Z
Ahcv2oufORQ,David Koma Ready to Wear 2013 Vogue Fashion Week Runway Show,465,2012-09-17T17:32:41Z
tVapcQ-FoZM,Michael van der Ham Ready to Wear Spring 2013 Vogue Fashion Week Runway Show,303,2012-09-17T16:48:57Z
GHNy9ZDTpTk,Antonio Berardi Ready to Wear 2013 Vogue Fashion Week Runway Show,1229,2012-09-17T16:46:07Z
ekAleHSL22k,Jonathan Saunders Ready to Wear Spring 2013 Vogue Fashion Week Runway Show,2323,2012-09-16T22:46:21Z
hMJ4Ru3qqCY,Mary Katrantzou Ready to Wear 2013 Vogue Fashion Week Runway Show,1941,2012-09-16T22:09:25Z
UV0LywmmW8M,Paul Smith Ready to Wear Spring 2013 Vogue Fashion Week Runway Show,2572,2012-09-16T20:36:35Z
-R2XmO2jkVw,Topshop Unique Ready to Wear Spring 2013 Vogue Fashion Week Runway Show,1448,2012-09-16T20:19:40Z
FV3Oo80Q1EA,Acne Ready to Wear Spring 2013 Vogue Fashion Week Runway Show,3189,2012-09-16T19:26:58Z
FzSOPg_XIwU,Marios Schwab Ready to Wear Spring 2013 Vogue Fashion Week Runway Show,1361,2012-09-16T18:38:12Z
n-gLtzN5_1U,Matthew Williamson Ready to Wear Spring 2013 Vogue Fashion Week Runway Show,1661,2012-09-16T17:59:38Z
AzuTS55vFF8,Christopher Raeburn Ready to Wear Spring 2013 Vogue Fashion Week Runway Show,721,2012-09-16T16:23:07Z
gLf9O7GpQ5I,Preen Ready to Wear Spring 2013 Vogue Fashion Week Runway Show,1609,2012-09-16T15:52:45Z
n7qMj8nlVWQ,Holly Fulton Ready to Wear Spring 2013 Vogue Fashion Week Runway Show,829,2012-09-15T17:23:33Z
M9vZU3P8kjk,This is New York: A Look Back at Fashion Week Spring 2013,1101,2012-09-15T00:20:03Z
uxcitg7fZI8,Calvin Klein Collection Ready to Wear 2013 Vogue Fashion Week Runway Show,758,2012-09-14T00:37:47Z
QJgsX7O5OQk,Ralph Lauren Ready to Wear 2013 Vogue Fashion Week Runway Show,4031,2012-09-14T00:37:06Z
K04xv-SeV6s,Proenza Schouler Ready to Wear Spring 2013 Vogue Fashion Week Runway Show,2107,2012-09-13T02:10:30Z
fsw077VsDrs,Reed Krakoff Ready to Wear Spring 2013 Vogue Fashion Week Runway Show,405,2012-09-12T23:13:32Z
GHhELVsy2Vs,Marchesa Ready to Wear Spring 2013 Vogue Fashion Week Runway Show,9866,2012-09-12T23:10:09Z
-OruSYus1q4,J. Mendel Ready to Wear Spring 2013 Vogue Fashion Week Runway Show,559,2012-09-12T20:58:32Z
2XoAIrBZul0,Michael Kors Ready to Wear Spring 2013 Vogue Fashion Week Runway Show,1071,2012-09-12T18:12:45Z
cWV4G1hbkQA,Oscar de la Renta Ready to Wear Spring 2013 Vogue Fashion Week Runway Show,4679,2012-09-12T02:33:08Z
j7XvkV1WLQg,Sophie Theallet Ready to Wear Spring 2013 Vogue Fashion Week Runway Show,526,2012-09-12T02:31:21Z
qUG2gv4zxVU,Narciso Rodriguez Ready to Wear Spring 2013 Vogue Fashion Week Runway Show,2101,2012-09-12T02:30:32Z
iDAbRx92D_Q,Marc by Marc Jacobs Ready to Wear Spring 2013 Vogue Fashion Week Runway Show,4636,2012-09-12T01:07:48Z
HgbKVVdSdUw,Rodarte Ready to Wear Spring 2013 Vogue Fashion Week Runway Show,4162,2012-09-11T19:57:53Z
Ho9Zhq9hZ-A,Vera Wang Ready to Wear Spring 2013 Vogue Fashion Week Runway Show,1159,2012-09-11T19:44:33Z
iiu13IHQ-MA,Tory Burch Ready to Wear Spring 2013 Vogue Fashion Week Runway Show,1235,2012-09-11T19:01:43Z
9OTqawogIwA,Donna Karan Ready to Wear Spring 2013 Vogue Fashion Week Runway Show,777,2012-09-11T18:01:06Z
mGQt6KwJsAg,Marc Jacobs Ready to Wear Spring 2013 Vogue Fashion Week Runway Show,3831,2012-09-11T02:55:02Z
Ekg_Ttk2IoA,Zero Maria Cornejo Ready to Wear Spring 2013 Vogue Fashion Week Runway Show,1471,2012-09-11T02:23:48Z
9eGZFyrm2nA,3.1 Phillip Lim Ready to Wear Spring 2013 Vogue Fashion Week Runway Show,7081,2012-09-11T01:19:17Z
YaRM7WOY2qc,Ohne Titel Ready to Wear 2013 Vogue Fashion Week Runway Show,338,2012-09-10T23:58:43Z
9lwb7tQiOQY,Belstaff Ready to Wear Spring 2013 Vogue Fashion Week Runway Show,804,2012-09-10T23:42:09Z
mawOTh21wbk,Theyskens' Theory Ready to Wear 2013 Vogue Fashion Week Runway Show,2102,2012-09-10T20:38:41Z
Fwwxd906zT8,Carolina Herrera Ready to Wear 2013 Vogue Fashion Week Runway Show,1652,2012-09-10T17:00:44Z
ZBZ0imQXYOI,Tommy Hilfiger Ready to Wear 2013 Vogue Fashion Week Runway Show,2094,2012-09-10T03:52:24Z
fYwURJs0Sf0,Zac Posen Ready to Wear Spring 2013 Vogue Fashion Week Runway Show,27569,2012-09-10T03:32:23Z
TBF-fUa0_ow,Thakoon Ready to Wear Spring 2013 Vogue Fashion Week Runway Show,1826,2012-09-10T02:11:11Z
